1360530,,,,,969000.0,,,,,,,,,27979000.0,,,,,,,,,,,,,,,,,,,,,,,
1402857,0.0,,,Clear Skies Solar Inc,,,,,1402857.0,,,,,,,,,,,1.0,,,,,,,,,,"Ventilation, Heating, Air-Conditioning, and Commercial Refrigeration Equipment Manufacturing",,,,,,,
1473505,1.0,,,Cequence Energy Ltd,,,,,1473505.0,,,,,,,,,,,0.0,,,,,,,,,,Oil and Gas Extraction,,,,,,,
1400897,1.0,,,Cushing MLP & Infrastructure Total Return Fund,,,,,1400897.0,,,,,,,,,,,0.0,,,,,,,,,,Other Investment Pools and Funds,,,,,,,
1395864,,,,Verso Paper Holdings LLC,,,,,1395864.0,,,,,,,,,,,,,,,,,,,,,"Pulp, Paper, and Paperboard Mills",,,,,,,
1384139,1.0,,,Cheyenne Resources Corp,,,,,1384139.0,,,,,,,,,,,0.0,,,,,,,,,,"Data Processing, Hosting, and Related Services",,,,,,,
1335105,1.0,,,Lixte Biotechnology Holdings Inc,,,,,1335105.0,,,,,,,,,,,0.0,,,,,,,,,,Scientific Research and Development Services,,,,,,,
1346917,1.0,,,Gentor Resources Inc,,,,,1346917.0,,,,,,,,,,,0.0,,,,,,,,,,Metal Ore Mining,,,,,,,
1383088,1.0,,,Cytta Corp,,,,,1383088.0,,,,,,,,,,,0.0,,,,,,,,,,Communications Equipment Manufacturing,,,,,,,
1355042,1.0,,,China Auto Logistics Inc,,,,,1355042.0,,,,,,,,,,,0.0,,,,,,,,,,Motor Vehicle and Motor Vehicle Parts and Supplies Merchant Wholesalers,,,,,,,
1384365,1.0,,,RAADR Inc,,,,,1384365.0,,,,,,,,,,,0.0,,,,,,,,,,Computer Systems Design and Related Services,,,,,,,
816761,1.0,,,Teradata Corp,,,,,816761.0,,,,,,,,,,,0.0,,,,,,,,,,Computer Systems Design and Related Services,,,,,,,
1370544,0.0,,,Smoky Market Foods Inc,,,,,1370544.0,,,,,,,,,,,1.0,,,,,,,,,,Animal Slaughtering and Processing,,,,,,,
1398664,0.0,,,Encore Energy Partners LP,,,,,1398664.0,,,,,,,,,,,1.0,,,,,,,,,,Oil and Gas Extraction,,,,,,,
1353970,1.0,,,China XD Plastics Company Ltd,,,,,1353970.0,,,,,,,,,,,0.0,,,,,,,,,,Plastics Product Manufacturing,,,,,,,
1393283,1.0,,,Nationsmark Nexgen,,,,,1393283.0,,,,,,,,,,,0.0,,,,,,,,,,Metal Ore Mining,,,,,,,
1062536,0.0,,,Zars Pharma Inc,,,,,1062536.0,,,,,,,,,,,1.0,,,,,,,,,,Pharmaceutical and Medicine Manufacturing,,,,,,,
1062536,,,,,,,,,1083366.0,,,,,,,,,,,,,,,,,,,,,,,,,,,,
1412100,1.0,,,Maiden Holdings Ltd,,,,,1407764.0,,,,,,,,,,,0.0,,,,,,,,,,Insurance Carriers,,,,,,,
1412100,,,,,,,,,1412100.0,,,,,,,,,,,,,,,,,,,,,,,,,,,,
1403275,0.0,,,First Trust Dividend and Income Fund,,,,,1403275.0,,,,,,,,,,,1.0,,,,,,,,,,Other Investment Pools and Funds,,,,,,,
1210618,1.0,,,SPI Energy Co Ltd,,,,,1210618.0,,,,,,,,,,,0.0,,,,,,,,,,Other Investment Pools and Funds,,,,,,,
1210618,,,,,,,,,1641771.0,,,,,,,,,,,,,,,,,,,,,,,,,,,,
1348909,,19000.0,,Argonaut Gold Inc,-906000.0,-112000.0,50000.0,,1348909.0,109000.0,-112000.0,,,,,-20060000.0,,,,,,154000.0,317000.0,425000.0,-112000.0,-906000.0,317000.0,,,Support Activities for Mining,-112000.0,-0.03965,30000.0,,,49000.0,
1348909,,19000.0,,,-906000.0,-112000.0,50000.0,,,109000.0,-112000.0,,,,,-20060000.0,,,,,,154000.0,317000.0,425000.0,-112000.0,-906000.0,317000.0,,,,-112000.0,-0.03965,30000.0,,,49000.0,
1404804,1.0,,,Omnitek Engineering Corp,,,,,1404804.0,,,,,,,,,,,0.0,,,,,,,,,,Motor Vehicle Parts Manufacturing,,,,,,,
1395627,1.0,,,Voya International High Dividend Equity Income Fund,,,,,1395627.0,,,,,,,,,,,0.0,,,,,,,,,,Other Investment Pools and Funds,,,,,,,
1517179,1.0,,,Monitor Ventures Inc,,,,,1517179.0,,,,,,,,,,,0.0,,,,,,,,,,Other Financial Investment Activities,,,,,,,
1448397,1.0,,,Seanergy Maritime Holdings Corp,,,,,1448397.0,,,,,,,,,,,0.0,,,,,,,,,,"Deep Sea, Coastal, and Great Lakes Water Transportation",,,,,,,
892449,0.0,,,Venture Financial Group Inc,,,,,892449.0,,,,,,,,,,,1.0,,,,,,,,,,Depository Credit Intermediation,,,,,,,
1407298,1.0,,,FLY Leasing Ltd,,,,,1407298.0,,,,,,,,,,,0.0,,,,,,,,,,Commercial and Industrial Machinery and Equipment Rental and Leasing,,,,,,,
1396502,1.0,,,John Hancock Tax-Advantaged Global Shareholder Yield Fund,,,,,1396502.0,,,,,,,,,,,0.0,,,,,,,,,,Other Investment Pools and Funds,,,,,,,
1374328,1.0,,,FitLife Brands Inc,,,,,1374328.0,,,,,,,,,,,0.0,,,,,,,,,,Health and Personal Care Stores,,,,,,,
1461640,0.0,,,HomeTown Bankshares Corp,,,,,1461640.0,,,,,,,,,,,1.0,,,,,,,,,,Depository Credit Intermediation,,,,,,,
1403238,0.0,,,BlackRock EcoSolutions Investment Trust,,,,,1403238.0,,,,,,,,,,,1.0,,,,,,,,,,Other Investment Pools and Funds,,,,,,,
1398481,0.0,,,Allianzgi Global Equity & Convertible Income Fund,,,,,1398481.0,,,,,,,,,,,1.0,,,,,,,,,,Other Investment Pools and Funds,,,,,,,
1287668,1.0,,,China Cgame Inc,,,,,1287668.0,,,,,,,,,,,0.0,,,,,,,,,,"Foundation, Structure, and Building Exterior Contractors",,,,,,,
1287668,,,,,3572000.0,,,,,,,,,16554000.0,,,,,,,,,,,,,,,,,,,,,,,
1402175,,,,Hicks Acquisition Company I Inc,,,,,1402175.0,,,,,,,,,,,,,,,,,,,,,Other Financial Investment Activities,,,,,,,
1397821,0.0,,,Deerfield Duff & Phelps LLC,,,,,1397821.0,,,,,,,,,,,1.0,,,,,,,,,,Other Financial Investment Activities,,,,,,,
1397821,,,,,-1077000.0,,800000.0,,,,,,,20528000.0,,,,,,,,,,,,,,,,,,,,,,,
1398931,0.0,58712000.0,,Renegy Holdings Inc,-16450000.0,57470000.0,,,1398931.0,57470000.0,57470000.0,-124000.0,,5487000.0,,-59885000.0,1364000.0,,,1.0,,61764000.0,10302000.0,67772000.0,57470000.0,-15910000.0,10213000.0,,,"Electric Power Generation, Transmission and Distribution",57470000.0,4.71143,-58468000.0,,,244000.0,
1398931,,87647000.0,,,-21511000.0,86722000.0,,,,86722000.0,86722000.0,-124000.0,,5523000.0,,-79474000.0,-535000.0,,,,,89685000.0,8418000.0,95140000.0,86722000.0,-19589000.0,8355000.0,,,,86722000.0,4.96604,-87524000.0,,,123000.0,
1522584,0.0,,,Golden Sun Mining Corp,,,,,1522584.0,,,,,,,,,,,0.0,,,,,,,,,,Metal Ore Mining,,,,,,,
1401573,0.0,,,Beacon Federal Bancorp Inc,,,,,1401573.0,,,,,,,,,,,1.0,,,,,,,,,,Depository Credit Intermediation,,,,,,,
1405277,0.0,,,Constant Contact Inc,,,,,1405277.0,,,,,,,,,,,1.0,,,,,,,,,,Computer Systems Design and Related Services,,,,,,,
1405277,,,,,-3809000.0,,,,1090909.0,,,,,1934000.0,,,,,,,,,,,,,,,,,,,,,,,
1368365,1.0,,,Remark Holdings Inc,,,,,1368365.0,,,,,,,,,,,0.0,,,,,,,,,,Software Publishers,,,,,,,
1398632,0.0,,,Highlands Acquisition Corp,,,,,1398632.0,,,,,,,,,,,1.0,,,,,,,,,,Other Investment Pools and Funds,,,,,,,
1389771,0.0,,,Inter Atlantic Financial Inc,,,,,1389771.0,,,,,,,,,,,1.0,,,,,,,,,,Other Investment Pools and Funds,,,,,,,
1408198,1.0,,,MSCI Inc,,,,,1408198.0,,,,,,,,,,,0.0,,,,,,,,,,Software Publishers,,,,,,,
1408198,,60593000.0,,,14408000.0,,0.0,,,25175000.0,,,,83776000.0,,,,,,,,,,84123000.0,,,,,,,,,,,,,
1404935,1.0,,,Thc Therapeutics Inc,,,,,1404935.0,,,,,,,,,,,0.0,,,,,,,,,,Pharmaceutical and Medicine Manufacturing,,,,,,,
1404935,,,,,,,,,1737463.0,,,,,,,,,,,,,,,,,,,,,,,,,,,,
1397911,1.0,,,LPL Financial Holdings Inc,,,,,1397911.0,,,,,,,,,,,0.0,,,,,,,,,,Securities and Commodity Contracts Intermediation and Brokerage,,,,,,,
1397911,,,,,,,,,1356456.0,,,,,,,,,,,,,,,,,,,,,,,,,,,,
1405503,0.0,,,China Digital TV Holding Co Ltd,,,,,1405503.0,,,,,,,,,,,0.0,,,,,,,,,,Cable and Other Subscription Programming,,,,,,,
1396440,1.0,,,Main Street Capital Corp,,,,,1396440.0,,,,,,,,,,,0.0,,,,,,,,,,Other Investment Pools and Funds,,,,,,,
1401923,0.0,,,MAP Pharmaceuticals Inc,,,,,1302256.0,,,,,,,,,,,1.0,,,,,,,,,,Scientific Research and Development Services,,,,,,,
1401923,,,,,,,,,1401923.0,,,,,,,,,,,,,,,,,,,,,,,,,,,,
1383116,1.0,,,Volcan Holdings Inc,,,,,1383116.0,,,,,,,,,,,0.0,,,,,,,,,,Metal Ore Mining,,,,,,,
1408287,0.0,,,Zep Inc,,,,,1408287.0,,,,,,,,,,,1.0,,,,,,,,,,"Soap, Cleaning Compound, and Toilet Preparation Manufacturing",,,,,,,
1408287,,,,,39686000.0,,,,,,,,,497914000.0,,,,,,,,,,,,,,,,,,,,,,,
1407623,1.0,,,Retail Opportunity Investments Corp,,,,,1407623.0,,,,,,,,,,,0.0,,,,,,,,,,Lessors of Real Estate,,,,,,,
1404624,0.0,,,Affinion Group Holdings Inc,,,,,1404624.0,,,,,,,,,,,1.0,,,,,,,,,,"Management, Scientific, and Technical Consulting Services",,,,,,,
1404624,,,,,602000000.0,,45300000.0,,,,,,,1458400000.0,,,,,,,,,,,,,,,,,,,,,,,
855667,1.0,,,Neenah Enterprises Inc,,,,,855667.0,,,,,,,,,,,0.0,,,,,,,,,,Foundries,,,,,,,
1401564,1.0,,,First Financial Northwest Inc,,,,,1401564.0,,,,,,,,,,,0.0,,,,,,,,,,Depository Credit Intermediation,,,,,,,
1401564,,,,,,,,,,,,,,,,,,,,,,,575054000.0,653664000.0,,,,,,,,,,,,,
1398161,0.0,,,Targanta Therapeutics Corp,,,,,1398161.0,,,,,,,,,,,1.0,,,,,,,,,,Scientific Research and Development Services,,,,,,,
1398161,,,,,-2134000.0,,,,,,,,,,,,,,,,,,,,,,,,,,,,,,,,
1253955,0.0,,,Compellent Technologies Inc,,,,,1253955.0,,,,,,,,,,,1.0,,,,,,,,,,Computer Systems Design and Related Services,,,,,,,
1253955,,,,,-1569000.0,,,,,,,,,0.0,,,,,,,,,,,,,,,,,,,,,,,
1413159,1.0,,,Textainer Group Holdings Ltd,,,,,1413159.0,,,,,,,,,,,0.0,,,,,,,,,,Commercial and Industrial Machinery and Equipment Rental and Leasing,,,,,,,
1413159,,,,,46008000.0,,0.0,,,,,,,126196000.0,,,,,,,,,,,,,,,,,,,,,,,
1396546,0.0,,,Virgin Mobile USA Inc,,,,,1396546.0,,,,,,,,,,,1.0,,,,,,,,,,Wireless Telecommunications Carriers (except Satellite),,,,,,,
1393718,0.0,,,SP Acquisition Holdings Inc,,,,,1393718.0,,,,,,,,,,,1.0,,,,,,,,,,Other Investment Pools and Funds,,,,,,,
1549276,0.0,,,Laporte Bancorp Inc,,,,,1549276.0,,,,,,,,,,,1.0,,,,,,,,,,Depository Credit Intermediation,,,,,,,
1376812,0.0,,,Patriot Coal Corp,,,,,1376812.0,,,,,,,,,,,1.0,,,,,,,,,,Coal Mining,,,,,,,
1376812,,,,,-109654000.0,,58041000.0,,,,,,,684992000.0,,,,,,,,,,,,,,,,,,,,,,,
1411825,0.0,,,Noah Education Holdings Ltd,,,,,1411825.0,,,,,,,,,,,1.0,,,,,,,,,,Commercial and Service Industry Machinery Manufacturing,,,,,,,
1407739,0.0,,,DuPont Fabros Technology Inc,,,,,1407739.0,,,,,,,,,,,1.0,,,,,,,,,,Lessors of Real Estate,,,,,,,
1403548,1.0,,,Blue Sugars Corp,,,,,1403548.0,,,,,,,,,,,0.0,,,,,,,,,,Basic Chemical Manufacturing,,,,,,,
1469160,0.0,190000.0,,Crocotta Energy Inc,-11000.0,189000.0,,,1469160.0,189000.0,189000.0,,,,,-11000.0,,,1750000.0,1.0,,190000.0,2000.0,190000.0,189000.0,-11000.0,2000.0,,,Oil and Gas Extraction,189000.0,0.945,-190000.0,,,0.0,
1469160,,574000.0,,,-51000.0,557000.0,0.0,,,557000.0,557000.0,0.0,,0.0,,-62000.0,,,6050000.0,,,578000.0,21000.0,578000.0,557000.0,-51000.0,21000.0,,,,557000.0,1.23778,-574000.0,,,0.0,
1417447,0.0,,,High Desert Gold Corp,,,,,1417447.0,,,,,,,,,,,1.0,,,,,,,,,,Metal Ore Mining,,,,,,,
1405287,0.0,,,Stream Global Services Inc,,,,,1405287.0,,,,,,,,,,,1.0,,,,,,,,,,Other Information Services,,,,,,,
1328792,1.0,,,TechPrecision Corp,,,,,1328792.0,,,,,,,,,,,0.0,,,,,,,,,,"Machine Shops; Turned Product; and Screw, Nut, and Bolt Manufacturing",,,,,,,
1399768,0.0,,,Metavante Technologies Inc,,,,,1399768.0,,,,,,,,,,,1.0,,,,,,,,,,Activities Related to Credit Intermediation,,,,,,,
1389034,1.0,,,Kallo Inc,,,,,1389034.0,,,,,,,,,,,0.0,,,,,,,,,,Computer Systems Design and Related Services,,,,,,,
1028637,0.0,8868000.0,,Corgi International Ltd,5019000.0,28870000.0,1974000.0,,1028637.0,77268000.0,28870000.0,599000.0,,135005000.0,,40064000.0,63000.0,,,1.0,,55778000.0,62936000.0,140204000.0,28870000.0,72000.0,45765000.0,,,Other Miscellaneous Manufacturing,28870000.0,19.60878,24222000.0,,,31837000.0,
1028637,,3895000.0,,,-5392000.0,20109000.0,1376000.0,,,66504000.0,20109000.0,2422000.0,,92481000.0,,29437000.0,126000.0,,,,,46682000.0,57522000.0,124026000.0,20109000.0,-8245000.0,55183000.0,,,,20109000.0,13.65822,24294000.0,,,26838000.0,
1405082,0.0,,,Triplecrown Acquisition Corp,,,,,1405082.0,,,,,,,,,,,1.0,,,,,,,,,,Other Investment Pools and Funds,,,,,,,
1514998,0.0,,,WesternZagros Resources ULC,,,,,1514998.0,,,,,,,,,,,1.0,,,,,,,,,,Oil and Gas Extraction,,,,,,,
1376139,1.0,,,CVR Energy Inc,,,,,1376139.0,,,,,,,,,,,0.0,,,,,,,,,,Petroleum and Coal Products Manufacturing,,,,,,,
1382696,0.0,,,Fuqi International Inc,,,,,1382696.0,,,,,,,,,,,1.0,,,,,,,,,,Other Miscellaneous Manufacturing,,,,,,,
1382696,,,,,1045000.0,,,,,,,,,15226000.0,,,,,,,,,,,,,,,,,,,,,,,
1726126,1.0,,,Epsilon Energy Ltd,,,,,1726126.0,,,,,,,,,,,0.0,,,,,,,,,,Oil and Gas Extraction,,,,,,,
1378706,0.0,,,American DG Energy Inc,,,,,1378706.0,,,,,,,,,,,1.0,,,,,,,,,,"Ventilation, Heating, Air-Conditioning, and Commercial Refrigeration Equipment Manufacturing",,,,,,,
1412494,0.0,,,Longtop Financial Technologies Ltd,,,,,1412494.0,,,,,,,,,,,1.0,,,,,,,,,,Software Publishers,,,,,,,
1412494,,,,,,,,,1369874.0,,,,,,,,,,,,,,,,,,,,,,,,,,,,
1464666,1.0,,,Grizzly Energy LLC,,,,,1464666.0,,,,,,,,,,,0.0,,,,,,,,,,Oil and Gas Extraction,,,,,,,
1464666,,5362000.0,,,4268000.0,13451000.0,2505000.0,,1384072.0,13451000.0,13451000.0,,,9313000.0,,,,,,,,9140000.0,29114000.0,42565000.0,13451000.0,,2297000.0,,,,13451000.0,1.22728,21455000.0,,,26817000.0,
1394409,,,,,,,,,,,,,,,,,,,,,,,,,,,,,,,,,,,,,
1606180,1.0,,,AAC Holdings Inc,,,,,1606180.0,,,,,,,,,,,0.0,,,,,,,,,,Outpatient Care Centers,,,,,,,
1399249,1.0,,,Pzena Investment Management Inc,,,,,1399249.0,,,,,,,,,,,0.0,,,,,,,,,,Other Financial Investment Activities,,,,,,,
1399249,,,,,15828000.0,,,,,,,,,32817000.0,,,,,,,,,,,,,,,,,,,,,,,
1403568,1.0,,,Ulta Beauty Inc,,,,,1403568.0,,,,,,,,,,,0.0,,,,,,,,,,Health and Personal Care Stores,,,,,,,
1357227,0.0,,,FGX International Holdings Ltd,-4434000.0,,0.0,,1357227.0,,,,,122739000.0,,,,,,1.0,,,,,,,,,,Medical Equipment and Supplies Manufacturing,,,,,,,
1357227,,,,,5277000.0,,0.0,,,,,,,116101000.0,,,,,,,,,,,,,,,,,,,,,,,
1398090,0.0,,,Power Medical Interventions Inc,,,,,1098274.0,,,,,,,,,,,1.0,,,,,,,,,,Medical Equipment and Supplies Manufacturing,,,,,,,
1398090,,,,,-20758000.0,,,,1398090.0,,,,,5016000.0,,,,,,,,,,,,,,,,,,,,,,,
1620742,1.0,,,Graphite One Inc,,,,,1620742.0,,,,,,,,,,,0.0,,,,,,,,,,Metal Ore Mining,,,,,,,
1620742,,,,,,,,,1545045.0,,,,,,,,,,,,,,,,,,,,,,,,,,,,
1138412,0.0,,,Genoptix Inc,,,,,1138412.0,,,,,,,,,,,1.0,,,,,,,,,,Medical and Diagnostic Laboratories,,,,,,,
1138412,,3878000.0,,,-12255000.0,,,,,4877000.0,,,,99000.0,,,,,,,,,,7604000.0,,,,,,,,,,,,1380000.0,
1402606,1.0,,,B Communications Ltd,,,,,1402606.0,,,,,,,,,,,0.0,,,,,,,,,,Wired Telecommunications Carriers,,,,,,,
1413855,1.0,,,Fanhua Inc,,,,,1413855.0,,,,,,,,,,,0.0,,,,,,,,,,"Agencies, Brokerages, and Other Insurance Related Activities",,,,,,,
1413855,,,,,30964107.0,,,,,,,,,180586713.0,,,,,,,,,,,,,,,,,,,,,,,
1105184,0.0,,,Nanosphere LLC,,,,,1362840.0,,,,,,,,,,,1.0,,,,,,,,,,Medical Equipment and Supplies Manufacturing,,,,,,,
1105184,,12453000.0,,,-6176000.0,,,,1105184.0,-10306000.0,,,,568000.0,,,,,,,,,,14233000.0,,,,,,,,,,,,0.0,
859313,0.0,,,Energiz Renewable Inc,,,,,859313.0,,,,,,,,,,,1.0,,,,,,,,,,Other Investment Pools and Funds,,,,,,,
1415016,0.0,,,Giant Interactive Group Inc,,,,,1415016.0,,,,,,,,,,,1.0,,,,,,,,,,Software Publishers,,,,,,,
1292653,0.0,,,Inteliquent Inc,,,,,1292653.0,,,,,,,,,,,1.0,,,,,,,,,,Computer Systems Design and Related Services,,,,,,,
1292653,,,,,,,,,1309600.0,,,,,,,,,,,,,,,,,,,,,,,,,,,,
1489161,1.0,,,Imaging Canada Liquidating Corp,,,,,1489161.0,,,,,,,,,,,0.0,,,,,,,,,,"Navigational, Measuring, Electromedical, and Control Instruments Manufacturing",,,,,,,
1365790,0.0,,,GLG Partners Inc,,,,,1365790.0,,,,,,,,,,,1.0,,,,,,,,,,Other Financial Investment Activities,,,,,,,
1413257,0.0,,,Agria Corp,,,,,1413257.0,,,,,,,,,,,1.0,,,,,,,,,,Oilseed and Grain Farming,,,,,,,
1413745,1.0,,,Airnet Technology Inc,,,,,1413745.0,,,,,,,,,,,0.0,,,,,,,,,,"Advertising, Public Relations, and Related Services",,,,,,,
1201792,1.0,,,American Public Education Inc,,,,,1201792.0,,,,,,,,,,,0.0,,,,,,,,,,"Colleges, Universities, and Professional Schools",,,,,,,
1201792,,7224000.0,,,-216000.0,,96000.0,,,-835000.0,,,,10655000.0,,,,,,,,,,10683000.0,,,,,,,,,,,,,
1405073,1.0,,,Approach Resources Inc,,,,,1405073.0,,,,,,,,,,,0.0,,,,,,,,,,Oil and Gas Extraction,,,,,,,
1410064,1.0,,,ARYx Therapeutics Inc,,,,,1410064.0,,,,,,,,,,,0.0,,,,,,,,,,Pharmaceutical and Medicine Manufacturing,,,,,,,
1410064,,8862000.0,,,-3721000.0,,,,,-4935000.0,,,,0.0,,,,,,,,,,9654000.0,,,,,,,,,,,,,
1282393,0.0,,,Merz Aesthetics Inc,,,,,1282393.0,,,,,,,,,,,1.0,,,,,,,,,,Medical Equipment and Supplies Manufacturing,,,,,,,
1406982,,,,Capitol Acquisition Corp,,,,,1406982.0,,,,,,,,,,,,,,,,,,,,,Other Financial Investment Activities,,,,,,,
1125376,1.0,,,Ensign Group Inc,,,,,1125376.0,,,,,,,,,,,0.0,,,,,,,,,,Nursing Care Facilities (Skilled Nursing Facilities),,,,,,,
1125376,,,,,5916000.0,,915000.0,,,,,,,102103000.0,,,,,,,,,,,,,,,,,,,,,,,
1407031,0.0,,,Golden Pond Healthcare Inc,,,,,1407031.0,,,,,,,,,,,1.0,,,,,,,,,,Other Investment Pools and Funds,,,,,,,
1334303,0.0,,,ICx Technologies Inc,,,,,1334303.0,,,,,,,,,,,1.0,,,,,,,,,,"Navigational, Measuring, Electromedical, and Control Instruments Manufacturing",,,,,,,
1396033,1.0,,,Lumber Liquidators Holdings Inc,,,,,1396033.0,,,,,,,,,,,0.0,,,,,,,,,,Lumber and Other Construction Materials Merchant Wholesalers,,,,,,,
1396033,,384000.0,,,4786000.0,,,,,,,,,65382000.0,,4260000.0,,,,,,,,13249000.0,,,,,,,,,,,,,
1317838,0.0,,,Aspire Japan Inc,,,,,1317838.0,,,,,,,,,,,1.0,,,,,,,,,,Lessors of Nonfinancial Intangible Assets (except Copyrighted Works),,,,,,,
1419521,,,,Hatteras Financial Corp,,,,,1419521.0,,,,,,,,,,,,,,,,,,,,,Other Financial Investment Activities,,,,,,,
1403256,1.0,,,Sculptor Capital Management Inc,,,,,1403256.0,,,,,,,,,,,0.0,,,,,,,,,,Other Financial Investment Activities,,,,,,,
1401521,1.0,,,United Insurance Holdings Corp,,,,,1401521.0,,,,,,,,,,,0.0,,,,,,,,,,Insurance Carriers,,,,,,,
1406391,,,,Enterprise Acquisition Corp,,,,,1406391.0,,,,,,,,,,,,,,,,,,,,,,,,,,,,
1205653,,,,,,,,,,,,,,,,,,,,,,,,,,,,,,,,,,,,,
1493225,1.0,,,Northfield Bancorp Inc,,,,,1493225.0,,,,,,,,,,,0.0,,,,,,,,,,Depository Credit Intermediation,,,,,,,
1407185,,,,Postrock Midcontinent Production LLC,,,,,1407185.0,,,,,,,,,,,,,,,,,,,,,Oil and Gas Extraction,,,,,,,
1414850,0.0,,,China Nepstar Chain Drugstore Ltd,,,,,1414850.0,,,,,,,,,,,1.0,,,,,,,,,,Health and Personal Care Stores,,,,,,,
1414850,,,,,-16379000.0,,,,,,,,,374106000.0,,,,,,,,,,,,,,,,,,,,,,,
1409134,0.0,,,Osg America LP,,,,,1409134.0,,,,,,,,,,,1.0,,,,,,,,,,Support Activities for Water Transportation,,,,,,,
1393744,0.0,,,EnergySolutions Inc,,,,,1393744.0,,,,,,,,,,,1.0,,,,,,,,,,Waste Treatment and Disposal,,,,,,,
1393744,,,,,54669000.0,,,,,,,,,143471000.0,,,,,,,,,,,,,,,,,,,,,,,
1371217,1.0,,,ReShape Lifesciences Inc,,,,,1371217.0,,,,,,,,,,,0.0,,,,,,,,,,"Navigational, Measuring, Electromedical, and Control Instruments Manufacturing",,,,,,,
1054303,0.0,862000.0,,Direct Markets Holdings Corp,651000.0,2079000.0,,,1054303.0,3639000.0,2079000.0,,,10239000.0,,-3494000.0,-240000.0,,3180000.0,1.0,,19606000.0,17758000.0,21397000.0,2079000.0,631000.0,17758000.0,,,Securities and Commodity Contracts Intermediation and Brokerage,2079000.0,25.6066,-536000.0,859000.0,,326000.0,
1054303,,862000.0,,,651000.0,2079000.0,,,,3639000.0,2079000.0,,,10239000.0,,-3494000.0,-240000.0,,2900000.0,,,19606000.0,17758000.0,21397000.0,2079000.0,631000.0,17758000.0,,,,2079000.0,25.6066,-536000.0,859000.0,,326000.0,
1232468,0.0,,,Reliant Technologies Inc,,,,,1232468.0,,,,,,,,,,,1.0,,,,,,,,,,"Navigational, Measuring, Electromedical, and Control Instruments Manufacturing",,,,,,,
1232468,,326000.0,,,-3947000.0,,,,,745000.0,,,,347000.0,,-2121000.0,,,,,,326000.0,72000.0,817000.0,,,,,,,,,,,,6000.0,
1080131,0.0,,,Internet Brands Inc,,,,,1080131.0,,,,,,,,,,,1.0,,,,,,,,,,Computer Systems Design and Related Services,,,,,,,
1080131,,,,,-24151000.0,,206000.0,,,,,,,29176000.0,,,,,,,,,,,,,,,,,,,,,,,
1403853,1.0,,,Nuverra Environmental Solutions Inc,,,,,1403853.0,,,,,,,,,,,0.0,,,,,,,,,,Support Activities for Mining,,,,,,,
1409012,,,,,,,,,,,,,,,,,,,,,,,,,,,,,,,,,,,,,
1406243,0.0,,,ReliaBrand Inc,,,,,1406243.0,,,,,,,,,,,0.0,,,,,,,,,,Other Investment Pools and Funds,,,,,,,
1409493,1.0,,,Chimera Investment Corp,,,,,1409493.0,,,,,,,,,,,0.0,,,,,,,,,,Nondepository Credit Intermediation,,,,,,,
1410838,0.0,,,El Paso Pipeline Partners LP,,,,,1410838.0,,,,,,,,,,,1.0,,,,,,,,,,Pipeline Transportation of Natural Gas,,,,,,,
1410838,,,,,34000000.0,,12000000.0,,,151000000.0,,,,69000000.0,,,,,,,,,,347000000.0,,,,,,,,,,,,,
1402225,0.0,,,Ideation Acquisition Corp,,,,,1402225.0,,,,,,,,,,,1.0,,,,,,,,,,Other Information Services,,,,,,,
1410172,1.0,,,Rubicon Technology Inc,,,,,1410172.0,,,,,,,,,,,0.0,,,,,,,,,,Semiconductor and Other Electronic Component Manufacturing,,,,,,,
1410172,,3123000.0,,,-5883000.0,,,,,-646000.0,,,,4023000.0,,,,,,,,,,14128000.0,,,,,,,,,,,,1417000.0,
1408501,0.0,,,3Par Inc,,,,,1408501.0,,,,,,,,,,,1.0,,,,,,,,,,Computer and Peripheral Equipment Manufacturing,,,,,,,
1408690,0.0,,,CreditcardsCom Inc,,,,,1408690.0,,,,,,,,,,,1.0,,,,,,,,,,Activities Related to Credit Intermediation,,,,,,,
1402305,0.0,,,SuccessFactors Inc,,,,,1157979.0,,,,,,,,,,,1.0,,,,,,,,,,Software Publishers,,,,,,,
1402305,,1305000.0,,,-2357000.0,,,,1402305.0,-4247000.0,,,,2461000.0,,,,,,,,,,4354000.0,,,,,,,,,,,,,
1413507,1.0,,,SRC Energy Inc,,,,,1413507.0,,,,,,,,,,,0.0,,,,,,,,,,Oil and Gas Extraction,,,,,,,
1413507,,,,,,,,,1445648.0,,,,,,,,,,,,,,,,,,,,,,,,,,,,
1381105,1.0,,,Plastic2Oil Inc,,,,,1381105.0,,,,,,,,,,,0.0,,,,,,,,,,Waste Treatment and Disposal,,,,,,,
1415921,1.0,,,Navios Maritime Partners LP,,,,,1415921.0,,,,,,,,,,,0.0,,,,,,,,,,"Deep Sea, Coastal, and Great Lakes Water Transportation",,,,,,,
1415921,,,,,359000.0,,0.0,,,,,,,3873000.0,,,,,,,,,,,,,,,,,,,,,,,
1397183,1.0,,,Iveda Solutions Inc,,,,,1397183.0,,,,,,,,,,,0.0,,,,,,,,,,Investigation and Security Services,,,,,,,
1386936,1.0,,,Gold Lakes Corp,,,,,1386936.0,,,,,,,,,,,0.0,,,,,,,,,,Metal Ore Mining,,,,,,,
1339729,0.0,,,Orchard Enterprises Inc,,,,,1339729.0,,,,,,,,,,,1.0,,,,,,,,,,Motion Picture and Video Industries,,,,,,,
1415948,,,,,,,,,,,,,,,,,,,,,,,,,,,,,,,,,,,,,
1406574,0.0,,,Sinohub Inc,,,,,1406574.0,,,,,,,,,,,1.0,,,,,,,,,,Household Appliances and Electrical and Electronic Goods Merchant Wholesalers,,,,,,,
1470683,1.0,,,China Ceramics Co Ltd,,,,,1470683.0,,,,,,,,,,,0.0,,,,,,,,,,Clay Product and Refractory Manufacturing,,,,,,,
1397047,1.0,,,FlexShopper Inc,,,,,1397047.0,,,,,,,,,,,0.0,,,,,,,,,,Commercial and Industrial Machinery and Equipment Rental and Leasing,,,,,,,
1397047,,,,,,,,,1385621.0,,,,,,,,,,,,,,,,,,,,,,,,,,,,
1412495,0.0,,,Nuveen Municipal High Income Opportunity Fund 2,,,,,1412495.0,,,,,,,,,,,0.0,,,,,,,,,,Other Investment Pools and Funds,,,,,,,
1431372,0.0,,,Gastar Exploration LLC,,,,,1431372.0,,,,,,,,,,410610000.0,0.0,,,,,,,,,,Oil and Gas Extraction,,,,,,,
1431372,,,,,-4700000.0,,360000.0,,,,,,,783000.0,,,,,410610000.0,,,,,,,-4599000.0,,,,,,,,,,,
1088787,1.0,9897000.0,,CD International Enterprises Inc,-1751000.0,15525000.0,,,1088787.0,15569000.0,15525000.0,-485000.0,,2163000.0,,-501000.0,,,30000.0,0.0,,10616000.0,5360000.0,20928000.0,15525000.0,-1108000.0,2022000.0,,,Nonferrous Metal (except Aluminum) Production and Processing,15525000.0,1552500.0,-9880000.0,,,17000.0,
1088787,,1629000.0,,,-1094000.0,2497000.0,,,,2497000.0,2497000.0,-67000.0,,1454000.0,,-3861000.0,,,0.0,,,2083000.0,203000.0,2700000.0,2497000.0,-1535000.0,203000.0,,,,2497000.0,249700.0,-1629000.0,,,0.0,
1408010,,,,Iggys House Inc,,,,,1408010.0,,,,,,,,,,,,,,,,,,,,,Offices of Real Estate Agents and Brokers,,,,,,,
1227930,0.0,,,Entropic Communications Inc,,,,,1227930.0,,,,,,,,,,,1.0,,,,,,,,,,Semiconductor and Other Electronic Component Manufacturing,,,,,,,
1227930,,3145000.0,,,-12305000.0,,0.0,,,-15494000.0,,,,0.0,,,,,,,,,,5079000.0,,,,,,,,,,,,2819000.0,
1400728,0.0,,,Well Power Inc,,,,,1400728.0,,,,,,,,,,,1.0,,,,,,,,,,Support Activities for Mining,,,,,,,
1488158,0.0,,,Labrador Iron Mines Holdings Ltd,,,,,1488158.0,,,,,,,,,,,0.0,,,,,,,,,,Metal Ore Mining,,,,,,,
1361009,0.0,,,CampusU Inc,,,,,1361009.0,,,,,,,,,,,1.0,,,,,,,,,,"Management, Scientific, and Technical Consulting Services",,,,,,,
1392600,,,,Severstal US Holdings II LLC,,,,,1392600.0,,,,,,,,,,,,,,,,,,,,,,,,,,,,
1407038,1.0,,,BG Medicine Inc,,,,,1407038.0,,,,,,,,,,,0.0,,,,,,,,,,Pharmaceutical and Medicine Manufacturing,,,,,,,
1407038,,,,,,,,,1169026.0,,,,,,,,,,,,,,,,,,,,,,,,,,,,
1407038,,,,,,,,,1308272.0,,,,,,,,,,,,,,,,,,,,,,,,,,,,
1407038,,,,,,,,,1323067.0,,,,,,,,,,,,,,,,,,,,,,,,,,,,
1409171,1.0,,,Titan Machinery Inc,,,,,1409171.0,,,,,,,,,,,0.0,,,,,,,,,,"Machinery, Equipment, and Supplies Merchant Wholesalers",,,,,,,
1409171,,,,,,,,,1224389.0,,,,,,,,,,,,,,,,,,,,,,,,,,,,
1418225,0.0,,,WSP Holdings Ltd,,,,,1418225.0,,,,,,,,,,,1.0,,,,,,,,,,"Agriculture, Construction, and Mining Machinery Manufacturing",,,,,,,
1415911,0.0,,,VisionChina Media Inc,,,,,1415911.0,,,,,,,,,,,1.0,,,,,,,,,,"Advertising, Public Relations, and Related Services",,,,,,,
1157408,1.0,,,K12 Inc,,,,,1157408.0,,,,,,,,,,,0.0,,,,,,,,,,Elementary and Secondary Schools,,,,,,,
1157408,,6008000.0,,,-30407000.0,,,,,-11064000.0,,,,6693000.0,,,,,,,,,,15755000.0,,,,,,,,,,,,0.0,
1546241,1.0,,,Select Sands Corp,,,,,1546241.0,,,,,,,,,,,0.0,,,,,,,,,,Nonmetallic Mineral Mining and Quarrying,,,,,,,
1412350,1.0,,,PIMCO Income Opportunity Fund,,,,,1412350.0,,,,,,,,,,,0.0,,,,,,,,,,Other Investment Pools and Funds,,,,,,,
1497246,0.0,,,Bullion Monarch Mining Inc,,,,,1497246.0,,,,,,,,,,,1.0,,,,,,,,,,Metal Ore Mining,,,,,,,
1410711,1.0,,,Armco Metals Holdings Inc,,,,,1410711.0,,,,,,,,,,,0.0,,,,,,,,,,Metal and Mineral (except Petroleum) Merchant Wholesalers,,,,,,,
1456346,1.0,,,Franco-Nevada Corp,,,,,1456346.0,,,,,,,,,,,0.0,,,,,,,,,,Other Financial Investment Activities,,,,,,,
1469907,1.0,,,Otis Gold Corp,,,,,1469907.0,,,,,,,,,,,0.0,,,,,,,,,,Metal Ore Mining,,,,,,,
1404306,1.0,,,First Advantage Bancorp,,,,,1404306.0,,,,,,,,,,,0.0,,,,,,,,,,Depository Credit Intermediation,,,,,,,
1408095,1.0,,,Premier Energy Corp,,,,,1408095.0,,,,,,,,,,,0.0,,,,,,,,,,Other Investment Pools and Funds,,,,,,,
1405037,0.0,,,United Refining Energy Corp,,,,,1405037.0,,,,,,,,,,,1.0,,,,,,,,,,Other Investment Pools and Funds,,,,,,,
1414048,,,,CGEN Digital Media Co Ltd,,,,,1414048.0,,,,,,,,,,,,,,,,,,,,,"Advertising, Public Relations, and Related Services",,,,,,,
1411419,0.0,,,ChinaEdu Corp,,,,,1411419.0,,,,,,,,,,,1.0,,,,,,,,,,Educational Support Services,,,,,,,
1409112,0.0,,,Classmates Media Corp,,,,,1409112.0,,,,,,,,,,,1.0,,,,,,,,,,Other Personal Services,,,,,,,
1409112,,13752000.0,,,,,,,,1102000.0,,,,66761000.0,,,,,,,,,,40704000.0,,,,,,,,,,,,,
1120105,0.0,,,Intellon Corp,,,,,1120105.0,,,,,,,,,,,1.0,,,,,,,,,,Semiconductor and Other Electronic Component Manufacturing,,,,,,,
