Instrument,Total Debt,Accounts Payable (CF),NAICS Industry Group Name,Inventories (CF),Delisted Quote Flag,Retained Earnings (Accumulated Deficit),Net Debt Incl. Pref.Stock & Min.Interest,Total Current Assets,Total Liabilities,Company Common Name,CIK Number,Total Equity,Tangible Book Value - Banks,Tangible Book Value - Insurance,"Net Income/Starting Line, Cumulative",Tangible Book Value - Reported,Cash and Short Term Investments,Market Value for Company,Tangible Book Value Per Share,Net Sales,Operating Income,Instrument Is Active Flag,Tangible Book Value - Utility,"Total Assets, Reported",Depreciation And Amortization,Total Current Liabilities
899581,,,,,,,,,,Hancock (John) Patriot Pref Div Fund,899581.0,,,,,,,,,,,,,,,
900422,,,Other Investment Pools and Funds,,0.0,,,,,Putnam Municipal Opportunities Trust,900422.0,,,,,,,477160000.0,,,,1.0,,,,
884719,17715000.0,88000.0,Software Publishers,235000.0,1.0,-122658000.0,15874000.0,11336000.0,24863000.0,Focus Enhancements Inc,884719.0,1057000.0,-12134000.0,-12134000.0,-17361000.0,-12134000.0,1841000.0,,-0.14321,29971000.0,-15986000.0,0.0,-12134000.0,25920000.0,156000.0,13370000.0
884719,,,,,,,,,,,1362091.0,,,,,,,,,,,,,,,
898660,,,Gambling Industries,,,,,,,Station Casinos Inc,898660.0,,,,,,,,,,,,,,,
1402057,4633500000.0,-199100000.0,Computer Systems Design and Related Services,78600000.0,0.0,-1805400000.0,4539100000.0,1419200000.0,6014100000.0,CDW Corp,1402057.0,262200000.0,-4296200000.0,-4296200000.0,-1765100000.0,-4296200000.0,94400000.0,,-25.50132,8071200000.0,-1387100000.0,1.0,-4296200000.0,6276300000.0,,541600000.0
899749,940186000.0,,Lessors of Real Estate,,0.0,,937475000.0,,1069960000.0,Healthcare Realty Trust Inc,899749.0,794820000.0,775320000.0,775320000.0,41760000.0,775320000.0,4138000.0,1273970000.0,13.08242,206394000.0,57446000.0,1.0,775320000.0,1864780000.0,49390000.0,
899629,753946000.0,,Lessors of Real Estate,,0.0,13671000.0,881761000.0,,1063661000.0,Acadia Realty Trust,899629.0,227722000.0,208246000.0,208246000.0,37437000.0,208246000.0,86691000.0,670930000.0,6.31052,98442000.0,36733000.0,1.0,208246000.0,1291383000.0,32749000.0,
902719,,,,,,,,,,BlackRock Investment Quality Municipal Income Trust,902719.0,,,,,,,,,,,,,,,
902731,,,Other Investment Pools and Funds,,1.0,,,,,Blackrock New Jersey Investment Quality Municipal Trust,902731.0,,,,,,,12300000.0,,,,0.0,,,,
902717,,,Other Investment Pools and Funds,,0.0,,,,,BlackRock Investment Quality Municipal Trust Inc,894242.0,,,,,,,227160000.0,,,,1.0,,,,
902717,,,,,,,,,,,902717.0,,,,,,,,,,,,,,,
902722,,,,,1.0,,,,,Blackrock California Investment Quality,902722.0,,,,,,,,,,,0.0,,,,
899296,66128457.0,,Nonferrous Metal (except Aluminum) Production and Processing,,0.0,157194025.0,-111160157.0,366562392.0,175958412.0,Invexans SA,899296.0,472581102.0,471156506.0,471156506.0,,471156506.0,191491304.0,181101400000.0,0.083228,367015853.0,7228824.0,1.0,471156506.0,648539514.0,,111106664.0
897802,,,Other Investment Pools and Funds,,0.0,,,,,Special Opportunities Fund Inc,897802.0,,,,,,,290650000.0,,,,1.0,,,,
1451505,13557000000.0,,Support Activities for Mining,,0.0,5827000000.0,12264000000.0,5349000000.0,18018000000.0,Transocean Ltd,1451505.0,17164000000.0,9036000000.0,9036000000.0,4029000000.0,9036000000.0,1296000000.0,26590820000.0,28.30276,12674000000.0,5354000000.0,1.0,9036000000.0,35182000000.0,1436000000.0,2701000000.0
1451505,,,,,,,,,,,1729635.0,,,,,,,,,,,,,,,
899715,786863000.0,,Lessors of Real Estate,,0.0,-201679000.0,887578000.0,,886714000.0,Tanger Factory Outlet Centers Inc,899715.0,235211000.0,160211000.0,160211000.0,29718000.0,160211000.0,4977000.0,1570560000.0,2.52958,243793000.0,69854000.0,1.0,160211000.0,1121925000.0,61392000.0,
855876,1313955000.0,,Depository Credit Intermediation,,1.0,516626000.0,,,15845446000.0,Sky Financial Group Inc,855876.0,1880648000.0,1078946000.0,1078946000.0,190338000.0,1078946000.0,,,9.2235,,,0.0,1078946000.0,17726094000.0,,
828878,19317930.0,,Lessors of Real Estate,,0.0,20466140.0,11103550.0,12262330.0,39073810.0,HH Biotechnology Holdings Co,828878.0,27331960.0,27331960.0,27331960.0,1411280.0,27331960.0,8214380.0,4120000.0,2.32415,3679040.0,-463590.0,1.0,27331960.0,66405770.0,243890.0,39073810.0
928054,129298000.0,12415000.0,"Agriculture, Construction, and Mining Machinery Manufacturing",-14522000.0,0.0,-10697000.0,129105000.0,77642000.0,168854000.0,Flotek Industries Inc,928054.0,65721000.0,-17737000.0,-17737000.0,-34242000.0,-17737000.0,193000.0,31410000.0,-0.77855,226063000.0,-30751000.0,1.0,-17737000.0,234575000.0,5570000.0,48573000.0
928054,,,,,,,,,,,1338810.0,,,,,,,,,,,,,,,
899051,5659000000.0,626000000.0,Insurance Carriers,,0.0,30207000000.0,,,122157000000.0,Allstate Corp,899051.0,12641000000.0,11767000000.0,11767000000.0,-1679000000.0,11767000000.0,,16115810000.0,21.95336,,-3019000000.0,1.0,11767000000.0,134798000000.0,,
943946,,,Architectural and Structural Metals Manufacturing,,0.0,,,,,Plaintree Systems Inc,943946.0,,,,,,,390000.0,,,,1.0,,,,
1680378,,,"Pesticide, Fertilizer, and Other Agricultural Chemical Manufacturing",,0.0,,,,,Senestech Inc,1680378.0,,,,,,,,,,,1.0,,,,
1673475,,,Other Information Services,,0.0,,,,,Global House Holdings Ltd,1673475.0,,,,,,,,,,,1.0,,,,
1388658,,,General Medical and Surgical Hospitals,,0.0,,,,,iRhythm Technologies Inc,1388658.0,,,,,,,,,,,1.0,,,,
1682325,,,Other Investment Pools and Funds,,0.0,,,,,Gty Technology Holdings Inc,1682325.0,,,,,,,,,,,1.0,,,,
1692412,,,Traveler Accommodation,,0.0,,,,,Playa Hotels & Resorts NV,1692412.0,,,,,,,,,,,1.0,,,,
828146,4007000.0,-736000.0,Semiconductor and Other Electronic Component Manufacturing,-591000.0,0.0,-46557000.0,-5241000.0,19025000.0,7919000.0,Interlink Electronics Inc,828146.0,12119000.0,11981000.0,11981000.0,-3311000.0,11981000.0,9248000.0,4960000.0,1.73915,13388000.0,-5442000.0,1.0,11981000.0,20038000.0,,7415000.0
929351,536521000.0,,Motion Picture and Video Industries,,0.0,-441153000.0,398046000.0,371666000.0,1625557000.0,Lions Gate Entertainment Corp,929351.0,41693000.0,-416613000.0,-416613000.0,-178454000.0,-416613000.0,138475000.0,683610000.0,-3.5623,1466374000.0,-138196000.0,1.0,-416613000.0,1667250000.0,7657000.0,412654000.0
929351,,,,,,,,,,,1337587.0,,,,,,,,,,,,,,,
1677761,,,Lessors of Real Estate,,1.0,,,,,Parkway Inc,1677761.0,,,,,,,,,,,0.0,,,,
1677761,,,,,,,,,,,729237.0,,,,,,,,,,,,,,,
884624,282769000.0,675000.0,Medical Equipment and Supplies Manufacturing,-13731000.0,0.0,29647000.0,268175000.0,274650000.0,359154000.0,Orthofix Medical Inc,884624.0,202061000.0,-34066000.0,-34066000.0,-228554000.0,-34066000.0,14594000.0,530000000.0,-1.9918,519675000.0,-262684000.0,1.0,-34066000.0,561215000.0,17094000.0,74995000.0
893821,4256000.0,-64000.0,Computer Systems Design and Related Services,,0.0,-102012000.0,3776000.0,1409000.0,10498000.0,Attunity Ltd,893821.0,2532000.0,-7287000.0,-7287000.0,-3857000.0,-7287000.0,480000.0,5800000.0,-1.25658,11472000.0,-2547000.0,0.0,-7287000.0,13030000.0,,6889000.0
885740,7177000.0,382000.0,Software Publishers,,0.0,-106727000.0,-628000.0,17363000.0,23434000.0,Sapiens International Corporation NV,885740.0,21743000.0,2092000.0,2092000.0,-303000.0,2092000.0,7938000.0,33850000.0,0.09689,43534000.0,2171000.0,1.0,2092000.0,45177000.0,,21869000.0
896494,26277000.0,-1618000.0,Communications Equipment Manufacturing,1951000.0,0.0,-26315000.0,7214000.0,69443000.0,59819000.0,Magal Security Systems Ltd,896494.0,30718000.0,25956000.0,25956000.0,-32602000.0,25956000.0,19063000.0,38260000.0,2.4966,57105000.0,-14560000.0,1.0,25956000.0,90537000.0,,53203000.0
892534,0.0,634000.0,Semiconductor and Other Electronic Component Manufacturing,-250000.0,1.0,-94644000.0,-45342000.0,57662000.0,11962000.0,EZchip Semiconductor Ltd,892534.0,152141000.0,49171000.0,49171000.0,-4637000.0,49171000.0,48115000.0,1110250000.0,2.10637,33566000.0,-6045000.0,0.0,49171000.0,164103000.0,,5108000.0
902272,8167000.0,-1338000.0,Other Miscellaneous Manufacturing,2278000.0,1.0,-17913000.0,2010000.0,27712000.0,15672000.0,Aldila Inc,902272.0,26260000.0,26260000.0,26260000.0,-2503000.0,26260000.0,6157000.0,18050000.0,5.0752,53606000.0,-3607000.0,0.0,26260000.0,41932000.0,,10844000.0
901491,130654000.0,-2071000.0,Limited-Service Eating Places,1828000.0,0.0,133759000.0,128542000.0,75348000.0,256482000.0,Papa John's International Inc,901491.0,129986000.0,53072000.0,53072000.0,36796000.0,53072000.0,10987000.0,659680000.0,0.96016,1126341000.0,65486000.0,1.0,53072000.0,386468000.0,32773000.0,100128000.0
1454797,254655000.0,,Lumber and Other Construction Materials Merchant Wholesalers,29210000.0,0.0,-102570000.0,254655000.0,220873000.0,352187000.0,Taiga Building Products Ltd,1454797.0,-89344000.0,-89344000.0,-89344000.0,192000.0,-89344000.0,,13610000.0,-2.77417,1005925000.0,23407000.0,1.0,-89344000.0,262843000.0,,193647000.0
895531,,,Other Investment Pools and Funds,,0.0,,,,,Invesco California Value Municipal Income Trust,895531.0,,,,,,,260700000.0,,,,1.0,,,,
895530,,,Other Investment Pools and Funds,,1.0,,,,,Van Kampen New York Value Municipal Income Trust,895530.0,,,,,,,,,,,0.0,,,,
895528,,,Other Financial Investment Activities,,,,,,,Invesco Pennsylvania Value Municipal Income Trust,895528.0,,,,,,,,,,,,,,,
903129,0.0,-4767000.0,Motor Vehicle Parts Manufacturing,-421000.0,0.0,-38505000.0,-25303000.0,37639000.0,7560000.0,Gentherm Inc,903129.0,45039000.0,41883000.0,41883000.0,3564000.0,41883000.0,25303000.0,170490000.0,1.9751,63613000.0,4554000.0,1.0,41883000.0,52599000.0,,7168000.0
902791,0.0,-635000.0,Employment Services,,0.0,79532000.0,-60182000.0,98609000.0,59438000.0,Barrett Business Services Inc,902791.0,110622000.0,63284000.0,63284000.0,5962000.0,63284000.0,60182000.0,128900000.0,5.97978,280468000.0,7658000.0,1.0,63284000.0,170060000.0,1536000.0,46116000.0
902270,108688000.0,-2778000.0,Glass and Glass Product Manufacturing,10931000.0,1.0,250301000.0,105607000.0,166635000.0,215964000.0,CAC Group Inc,902270.0,136142000.0,4217000.0,4217000.0,-15826000.0,4217000.0,3081000.0,,0.29703,452115000.0,-7380000.0,0.0,4217000.0,352106000.0,,62333000.0
1278653,60466000.0,,Metal Ore Mining,-18670000.0,0.0,-99590000.0,37024000.0,82457000.0,120353000.0,Semafo Inc,1278653.0,194320000.0,194320000.0,194320000.0,39529000.0,194320000.0,23442000.0,1110970000.0,0.83505,169911000.0,31922000.0,1.0,194320000.0,314673000.0,25445000.0,66253000.0
1666134,,,Software Publishers,,0.0,,,,,Blackline Inc,1666134.0,,,,,,,,,,,1.0,,,,
1679082,,,Scientific Research and Development Services,,0.0,,,,,Myovant Sciences Ltd,1679082.0,,,,,,,,,,,1.0,,,,
1677250,,,Couriers and Express Delivery Services,,0.0,,,,,ZTO Express (Cayman) Inc,1677250.0,,,,,,,,,,,1.0,,,,
1370702,,,Industrial Machinery Manufacturing,,0.0,,,,,On Semiconductor Connectivity Solutions Inc,1370702.0,,,,,,,,,,,0.0,,,,
778165,11547500.0,,Oil and Gas Extraction,,0.0,-59085380.0,11529340.0,18160.0,16006110.0,Rock Energy Resources Inc,778165.0,-14724160.0,-14724160.0,-14724160.0,-17948430.0,-14724160.0,18160.0,11870000.0,-0.19245,,-2686680.0,1.0,-14724160.0,1281960.0,15560.0,16006110.0
947994,85000.0,,Metal Ore Mining,,1.0,-38520000.0,70000.0,16000.0,127000.0,Globetech Ventures Corp,947994.0,727000.0,2000.0,2000.0,-519000.0,2000.0,15000.0,970000.0,6e-05,,-518950.0,0.0,2000.0,852000.0,890.0,127000.0
900708,393281000.0,-117239000.0,Electronics and Appliance Stores,178225000.0,1.0,-217500000.0,370506000.0,708187000.0,776426000.0,Bell Microproducts Inc,900708.0,5700000.0,-22826000.0,-22826000.0,-82466000.0,-22826000.0,22775000.0,,-0.71839,3579499000.0,-33886000.0,0.0,-22826000.0,782126000.0,,591094000.0
890515,,,Other Investment Pools and Funds,,1.0,,,,,Invesco Van Kampen Massachusetts Value Municipal Income Trust,890515.0,,,,,,,32440000.0,,,,0.0,,,,
889527,,,,,1.0,,,,,Van Kampen Ohio Value Municipal Income,889527.0,,,,,,,,,,,0.0,,,,
898685,419300000.0,,Support Activities for Mining,-10800000.0,0.0,198900000.0,-140000000.0,1331800000.0,1683400000.0,Subsea 7 SA,898685.0,787700000.0,783900000.0,783900000.0,307200000.0,783900000.0,573000000.0,17867520000.0,4.28792,2522400000.0,460800000.0,1.0,783900000.0,2471100000.0,,1114200000.0
902750,,,Other Investment Pools and Funds,,1.0,,,,,American Municipal Income Portfolio Inc,902750.0,,,,,,,80300000.0,,,0.0,0.0,,,,
892789,,,,,1.0,,,,,Blackrock Broad Investment Grade 2009 Term Trust Inc,892789.0,,,,,,,,,,,0.0,,,,
902978,,,Other Investment Pools and Funds,,1.0,,,,,Western Asset Emerging Markets Income Fund Inc,902978.0,,,,,,,352240000.0,,,0.0,0.0,,,,
907649,28696000.0,,Oil and Gas Extraction,-33000.0,1.0,-160100000.0,8003000.0,26681000.0,39648000.0,FX Energy Inc,907649.0,15154000.0,15154000.0,15154000.0,-54704000.0,15154000.0,20693000.0,121590000.0,0.35908,17841000.0,-30147000.0,0.0,15154000.0,54802000.0,1720000.0,12716000.0
902274,550257000.0,-39035000.0,Glass and Glass Product Manufacturing,-2027000.0,0.0,-145154000.0,536953000.0,291785000.0,879443000.0,Libbey Inc,902274.0,-57889000.0,-250746000.0,-250746000.0,-80463000.0,-250746000.0,13304000.0,123080000.0,-17.02265,812629000.0,-5548000.0,1.0,-250746000.0,821554000.0,,151026000.0
905000,,,Other Investment Pools and Funds,,,,,,,Nuveen California Premium Income Municipal Fund,905000.0,,,,,,,,,,,,,,,
901823,,,Other Investment Pools and Funds,,1.0,,,,,Putnam Managed High Yield Trust,901823.0,,,,,,,,,,,0.0,,,,
1481512,,,Scientific Research and Development Services,,0.0,,,,,Ra Pharmaceuticals Inc,1481512.0,,,,,,,,,,,1.0,,,,
902748,,,Other Financial Investment Activities,,1.0,,,,,Minnesota Municipal Income Portfolio Inc,902748.0,,,,,,,60540000.0,,,,0.0,,,,
1526125,,,"Data Processing, Hosting, and Related Services",,0.0,,,,,GDS Holdings Ltd,1526125.0,,,,,,,,,,,1.0,,,,
354908,182825000.0,-7324000.0,"Navigational, Measuring, Electromedical, and Control Instruments Manufacturing",-30178000.0,0.0,577090000.0,-106617000.0,812502000.0,396352000.0,FLIR Systems Inc,354908.0,844725000.0,562866000.0,562866000.0,200900000.0,562866000.0,289442000.0,4967830000.0,3.98103,1076974000.0,284491000.0,1.0,562866000.0,1241077000.0,,172275000.0
1672750,,,Aerospace Product and Parts Manufacturing,,,,,,,Mota Group Inc,1672750.0,,,,,,,,,,,,,,,
1685237,,,Travel Arrangement and Reservation Services,,0.0,,,,,Temir Corp,1685237.0,,,,,,,,,,,1.0,,,,
806514,2676000.0,,Plastics Product Manufacturing,-679000.0,1.0,-4685000.0,2323000.0,5461000.0,3188000.0,Advanced Materials Group Inc,806514.0,3929000.0,3929000.0,3929000.0,318000.0,3929000.0,353000.0,,0.31824,12304000.0,424000.0,0.0,3929000.0,7118000.0,41000.0,3014000.0
1621697,,,Software Publishers,,0.0,,,,,Natural Health Farm Holdings Inc,1621697.0,,,,,,,,,,,1.0,,,,
913353,266369000.0,13144000.0,Offices of Real Estate Agents and Brokers,-61000.0,0.0,-59061000.0,527799000.0,340858000.0,791496000.0,Colliers International Group Inc,913353.0,199141000.0,-472290000.0,-472290000.0,74867000.0,-472290000.0,79642000.0,600550000.0,-16.10071,1322680000.0,62735000.0,1.0,-472290000.0,990637000.0,31746000.0,285079000.0
1036030,10154000.0,,Depository Credit Intermediation,,0.0,12726000.0,,,370008000.0,Wayne Savings Bancshares Inc,1036030.0,34413000.0,32223000.0,32223000.0,1863000.0,32223000.0,,17450000.0,10.7263,,,1.0,32223000.0,404421000.0,,
1673358,,,Full-Service Restaurants,,0.0,,,,,Yum China Holdings Inc,1673358.0,,,,,,,,,,,1.0,,,,
901495,9952000.0,,Full-Service Restaurants,24000.0,1.0,4650000.0,4508000.0,7084000.0,16105000.0,Back Yard Burgers Inc,901495.0,17305000.0,15799000.0,15799000.0,876000.0,15799000.0,5444000.0,,3.09793,43858000.0,2176000.0,0.0,15799000.0,33410000.0,2192000.0,5789000.0
896195,8466000.0,-2346000.0,Computer and Peripheral Equipment Manufacturing,212000.0,1.0,-22984000.0,8466000.0,8969000.0,16396000.0,Global Epoint Inc,896195.0,6137000.0,-4538000.0,-4538000.0,-11214000.0,-4538000.0,,160000.0,-0.23375,32914000.0,-11303000.0,0.0,-4538000.0,22533000.0,475000.0,14399000.0
899849,18815000.0,,Performing Arts Companies,-32000.0,,-19643000.0,18308000.0,2445000.0,23045000.0,Elephant And Castle Group Inc,899849.0,-6077000.0,-6077000.0,-6077000.0,-334000.0,-6077000.0,507000.0,,-1.00407,36312000.0,-813000.0,,-6077000.0,16968000.0,1858000.0,3974000.0
1604868,,,Miscellaneous Nondurable Goods Merchant Wholesalers,,0.0,,,,,GrowGeneration Corp,1604868.0,,,,,,,,,,,1.0,,,,
904979,52500000.0,-4169000.0,Motor Vehicle Parts Manufacturing,10674000.0,0.0,58619000.0,52373000.0,99816000.0,156939000.0,Shiloh Industries Inc,904979.0,95492000.0,95492000.0,95492000.0,-17784000.0,95492000.0,127000.0,87470000.0,5.78637,269381000.0,-23182000.0,1.0,95492000.0,252431000.0,,74829000.0
904851,4479000000.0,1486000000.0,Petroleum and Coal Products Manufacturing,-876000000.0,0.0,3537000000.0,3263000000.0,9228000000.0,19445000000.0,YPF SA,904851.0,18973000000.0,18967000000.0,18967000000.0,3901000000.0,18967000000.0,1216000000.0,63729170000.0,48.22371,34875000000.0,6665000000.0,1.0,18967000000.0,38418000000.0,202000000.0,11986000000.0
902277,,,,,,,,,,,,,,,,,,,,,,,,,,
1668340,,,Depository Credit Intermediation,,0.0,,,,,Bancorp 34 Inc,1668340.0,,,,,,,23560000.0,,,,1.0,,,,
887153,12855000.0,653694000.0,Iron and Steel Mills and Ferroalloy Manufacturing,-2030274000.0,0.0,9237090000.0,2558456000.0,13045429000.0,12630862000.0,Grupo Simec SAB de CV,887153.0,18183155000.0,10827935000.0,10827935000.0,2936652000.0,10827935000.0,576741000.0,17857800000.0,21.75554,35185220000.0,3115229000.0,1.0,10827935000.0,30814017000.0,,5255145000.0
906526,0.0,,Radio and Television Broadcasting,0.0,0.0,301655000.0,-92329000.0,441566000.0,311573000.0,Grupo Radio Centro SAB de CV,906526.0,1432065000.0,603202000.0,603202000.0,172016000.0,603202000.0,93054000.0,2294410000.0,3.70689,735105000.0,238278000.0,1.0,603202000.0,1743638000.0,,228790000.0
904978,741355000.0,4032000.0,Nursing Care Facilities (Skilled Nursing Facilities),,1.0,-242683000.0,649202000.0,414820000.0,1139625000.0,Sun Healthcare Group Inc,904978.0,403709000.0,22513000.0,22513000.0,109287000.0,22513000.0,92153000.0,401180000.0,1.55104,1822766000.0,67161000.0,0.0,22513000.0,1543334000.0,40348000.0,242675000.0
1355839,90000.0,,Software Publishers,,0.0,-823000.0,-1439000.0,1916000.0,441000.0,Peerstream Inc,1355839.0,1524000.0,1524000.0,1524000.0,797000.0,1524000.0,1529000.0,4890000.0,1.6618,3012000.0,934000.0,1.0,1524000.0,1966000.0,13000.0,408000.0
1375195,1039280.0,,Communications Equipment Manufacturing,,0.0,-11010080.0,990880.0,64510.0,2382090.0,Coretec Group Inc,1375195.0,-2211750.0,-2211750.0,-2211750.0,-3611550.0,-2211750.0,48400.0,2000000.0,-147.54837,42900.0,-3489260.0,1.0,-2211750.0,170340.0,,1706810.0
1579998,1054462000.0,,Cable and Other Subscription Programming,,0.0,-7107000.0,1015004000.0,122821000.0,1623528000.0,Cogeco Communications Inc,1579998.0,1007384000.0,-168745000.0,-168745000.0,-258228000.0,-168745000.0,39458000.0,1699540000.0,-3.47508,1217837000.0,-147849000.0,1.0,-168745000.0,2630912000.0,245543000.0,363744000.0
864264,0.0,-262000.0,Other Investment Pools and Funds,,0.0,-137055000.0,-16576000.0,17190000.0,1024000.0,Simon Worldwide Inc,864264.0,16922000.0,16922000.0,16922000.0,621000.0,16922000.0,16576000.0,18430000.0,0.31221,0.0,-3610000.0,1.0,16922000.0,17946000.0,,1024000.0
904973,20652000.0,-1880000.0,Pharmaceutical and Medicine Manufacturing,-863000.0,1.0,-304115000.0,9009000.0,13755000.0,44526000.0,rEVO Biologics Inc,904973.0,-4123000.0,-10372000.0,-10372000.0,-22665000.0,-10372000.0,11643000.0,,-1.00733,16656000.0,-23207000.0,0.0,-10372000.0,40403000.0,,16057000.0
902754,,,Other Investment Pools and Funds,,,,,,,Van Kampen Municipal Opportunity Trust Ii,902754.0,,,,,,,,,,,,,,,
78890,188600000.0,,Investigation and Security Services,,0.0,310000000.0,29000000.0,832400000.0,1601800000.0,Brinks Co,78890.0,214000000.0,53300000.0,53300000.0,223100000.0,53300000.0,250900000.0,1164840000.0,1.1663,3163500000.0,228500000.0,1.0,53300000.0,1815800000.0,,535100000.0
900724,,,Other Investment Pools and Funds,,1.0,,,,,Blackrock Corporate High Yield Fund Inc,900724.0,,,,,,,238570000.0,,,,0.0,,,,
904901,233000.0,,Other Support Services,0.0,1.0,-20483000.0,232000.0,946000.0,240000.0,Watchit Technologies Inc,904901.0,1662000.0,706000.0,706000.0,-1394000.0,706000.0,1000.0,70000.0,0.00675,0.0,-1394000.0,0.0,706000.0,1903000.0,,240000.0
904112,,,Other Investment Pools and Funds,,0.0,,,,,Morgan Stanley Emerging Markets Debt Fund Inc,904112.0,,,,,,,222230000.0,,,,1.0,,,,
901243,,,Other Investment Pools and Funds,,0.0,,,,,BlackRock MuniAssets Fund Inc,901243.0,,,,,,,256330000.0,,,,1.0,,,,
903127,1112913000.0,,Lessors of Real Estate,,1.0,105300000.0,1050100000.0,,1265025000.0,Post Properties Inc,903127.0,987630000.0,987601000.0,987601000.0,-8370000.0,987601000.0,75472000.0,1040140000.0,22.3328,281940000.0,-47215000.0,0.0,987601000.0,2252655000.0,63530000.0,
906326,277309000.0,-872000.0,Other Ambulatory Health Care Services,-79000.0,1.0,-258331000.0,242026000.0,154925000.0,401687000.0,Rural/Metro Corp,906326.0,-106732000.0,-144982000.0,-144982000.0,6635000.0,-144982000.0,37108000.0,,-5.85633,491800000.0,45517000.0,0.0,-144982000.0,294955000.0,14258000.0,94255000.0
946647,85537000.0,,Depository Credit Intermediation,,0.0,126992000.0,,,1728241000.0,First Defiance Financial Corp,946647.0,229159000.0,121486000.0,121486000.0,7357000.0,121486000.0,,91650000.0,7.48332,,,1.0,121486000.0,1957400000.0,,
906345,2832396000.0,,Lessors of Real Estate,,0.0,-312309000.0,3012776000.0,,3318848000.0,Camden Property Trust,906345.0,1411494000.0,1411494000.0,1411494000.0,82025000.0,1411494000.0,7407000.0,2719090000.0,21.3772,612408000.0,-7435000.0,1.0,1411494000.0,4730342000.0,168488000.0,
906959,,,Other Investment Pools and Funds,,1.0,,,,,Nuveen Premium Income Municipal Opportunity Fund,906959.0,,,,,,,458970000.0,,,,0.0,,,,
907573,,,Other Investment Pools and Funds,,0.0,,,,,Delaware Investments Colorado Municipal Income Fund Inc,907573.0,,,,,,,63760000.0,,,,1.0,,,,
906193,6195000.0,-2883000.0,Industrial Machinery Manufacturing,-515000.0,1.0,32539000.0,-11947000.0,59550000.0,29258000.0,Key Technology Inc,906193.0,51457000.0,47937000.0,47937000.0,-491000.0,47937000.0,18142000.0,61850000.0,9.58964,105450000.0,-1157000.0,0.0,47937000.0,80715000.0,1270000.0,22517000.0
901824,,,Other Investment Pools and Funds,,0.0,,,,,Blackrock Massachusetts Tax-Exempt Trust,901824.0,,,,,,,27780000.0,,,,1.0,,,,
907608,,,Other Investment Pools and Funds,,1.0,,,,,Western Asset Municipal Partners Fund II Inc,907608.0,,,,,,,,,,,0.0,,,,
863157,585993000.0,25201000.0,Other Miscellaneous Store Retailers,-86151000.0,1.0,936100000.0,459679000.0,874834000.0,1213517000.0,PetSmart Inc,863157.0,1144136000.0,1105491000.0,1105491000.0,192670000.0,1105491000.0,126314000.0,3298050000.0,8.67991,5065293000.0,369854000.0,0.0,1105491000.0,2357653000.0,,478157000.0
1095075,0.0,,Metal Ore Mining,,1.0,-180250000.0,-25600000.0,26028000.0,17719000.0,Southwestern Resources Corp,1095075.0,22573000.0,22573000.0,22573000.0,-31815000.0,22573000.0,25600000.0,,0.50248,,-29404000.0,0.0,22573000.0,40292000.0,61000.0,17719000.0
908732,10067189000.0,,Petroleum and Coal Products Manufacturing,,0.0,6641371000.0,9606213000.0,6511351000.0,14266094000.0,Sinopec Shanghai Petrochemical Co Ltd,908732.0,13841371000.0,13263892000.0,13263892000.0,,13263892000.0,725329000.0,59721770000.0,1.22814,60310570000.0,-10364673000.0,1.0,13263892000.0,28107465000.0,,13342720000.0
908732,,,,,,,,,,,908832.0,,,,,,,,,,,,,,,
906013,,,Other Investment Pools and Funds,,0.0,,,,,AllianceBernstein Global High Income Fund Inc,906013.0,,,,,,,1131940000.0,,,,1.0,,,,
908256,0.0,0.0,Other Investment Pools and Funds,,0.0,-456115000.0,-12914000.0,104337000.0,36751000.0,China Enterprises Ltd,908256.0,538325000.0,538325000.0,538325000.0,-28178000.0,538325000.0,12914000.0,990000.0,59.69907,0.0,13117000.0,1.0,538325000.0,575076000.0,,17427000.0
1596369,,,Bakeries and Tortilla Manufacturing,,,,,,,Agricore United Holdings Inc,1596369.0,,,,,,,,,,,,,,,
906782,15905000.0,-6116000.0,Cut and Sew Apparel Manufacturing,-3392000.0,1.0,-183333000.0,15752000.0,19711000.0,23018000.0,Cygne Designs Inc,906782.0,11240000.0,-2437000.0,-2437000.0,-63860000.0,-2437000.0,153000.0,3030000.0,-0.06427,95753000.0,-60560000.0,0.0,-2437000.0,34258000.0,2022000.0,16907000.0
1677576,,,Lessors of Real Estate,,0.0,,,,,Innovative Industrial Properties Inc,1677576.0,,,,,,,,,,,1.0,,,,
909724,4510000.0,-348990.0,Miscellaneous Nondurable Goods Merchant Wholesalers,1469760.0,0.0,26642000.0,-6311000.0,29020000.0,9712000.0,Tandy Leather Factory Inc,909724.0,31264000.0,29942000.0,29942000.0,2604180.0,29942000.0,10821000.0,39750000.0,2.80762,52491540.0,4025340.0,1.0,29942000.0,40975000.0,,5070000.0
907687,0.0,,Semiconductor and Other Electronic Component Manufacturing,-24612000.0,1.0,36979000.0,-138750000.0,229177000.0,74936000.0,Microsemi Soc Corp,907687.0,268325000.0,232785000.0,232785000.0,-11725000.0,232785000.0,138750000.0,311080000.0,9.03068,218406000.0,-3331000.0,0.0,232785000.0,343261000.0,796000.0,59454000.0
895380,0.0,94000.0,Other Investment Pools and Funds,10000.0,1.0,-322792000.0,218000.0,56000.0,5722000.0,Allegro Biodiesel Corp,895380.0,-4850000.0,-5116000.0,-5116000.0,-6723000.0,-5116000.0,48000.0,170000.0,-0.1769,,-1516000.0,0.0,-5116000.0,871000.0,,5722000.0
906337,33271000.0,,Computer Systems Design and Related Services,260000.0,1.0,-252762000.0,31881000.0,15875000.0,47640000.0,PM Liquidating Corp,906337.0,-6985000.0,-27939000.0,-27939000.0,-36788000.0,-27939000.0,1390000.0,,-2.02707,54123000.0,-29073000.0,0.0,-27939000.0,40655000.0,6417000.0,46687000.0
907242,50000000.0,-626900.0,Traveler Accommodation,-68300.0,0.0,126296000.0,38243000.0,19946640.0,76906000.0,Monarch Casino & Resort Inc,907242.0,105595000.0,105595000.0,105595000.0,9540970.0,105595000.0,11757000.0,130620000.0,6.54973,66687520.0,14686380.0,1.0,105595000.0,182501640.0,9891800.0,27291000.0
