Instrument,Total Debt,Accounts Payable (CF),NAICS Industry Group Name,Inventories (CF),Delisted Quote Flag,Retained Earnings (Accumulated Deficit),Net Debt Incl. Pref.Stock & Min.Interest,Total Current Assets,Total Liabilities,Company Common Name,CIK Number,Total Equity,Tangible Book Value - Banks,Tangible Book Value - Insurance,"Net Income/Starting Line, Cumulative",Tangible Book Value - Reported,Cash and Short Term Investments,Market Value for Company,Tangible Book Value Per Share,Net Sales,Operating Income,Instrument Is Active Flag,Tangible Book Value - Utility,"Total Assets, Reported",Depreciation And Amortization,Total Current Liabilities
1107955,,,"Electric Power Generation, Transmission and Distribution",,,,,,,US Energy Initiatives Corp,1107955.0,,,,,,,,,,,,,,,
109758,205000000.0,-3523000.0,"Other Professional, Scientific, and Technical Services",,1.0,20167000.0,183957000.0,67658000.0,295950000.0,Nielsen Audio Inc,109758.0,-169109000.0,-201007000.0,-201007000.0,36462000.0,-201007000.0,21043000.0,990080000.0,-6.88333,227534000.0,71261000.0,0.0,-201007000.0,126841000.0,,84456000.0
1205643,0.0,,Services to Buildings and Dwellings,,0.0,-5242000.0,-25799000.0,,527000.0,GDI Integrated Facility Services Inc,1366690.0,41596000.0,25366000.0,25366000.0,-4777000.0,25366000.0,25799000.0,191590000.0,110.15764,,-4776000.0,1.0,25366000.0,42123000.0,1450000.0,
1205643,,,,,,,,,,,1157752.0,,,,,,,,,,,,,,,
1205643,,,,,,,,,,,1205643.0,,,,,,,,,,,,,,,
1135152,272900000.0,,"Agriculture, Construction, and Mining Machinery Manufacturing",-15100000.0,1.0,42300000.0,248300000.0,755100000.0,1019700000.0,FMC Technologies Inc,1135152.0,418200000.0,71100000.0,71100000.0,39400000.0,71100000.0,28000000.0,1335710000.0,0.27308,1927900000.0,75800000.0,0.0,71100000.0,1437900000.0,,680800000.0
1123979,906000.0,,Scientific Research and Development Services,,1.0,-47229000.0,43470000.0,28262000.0,6501000.0,Senomyx Inc,1123979.0,28219000.0,-44799000.0,-44799000.0,-14821000.0,-44799000.0,27586000.0,,-1.81536,7327000.0,-15160000.0,0.0,-44799000.0,34720000.0,,5595000.0
817720,2204000.0,-1422000.0,Computer and Peripheral Equipment Manufacturing,1423000.0,0.0,865000.0,-62976000.0,87253000.0,16378000.0,Synaptics Inc,817720.0,74003000.0,73198000.0,73198000.0,9400000.0,73198000.0,65180000.0,178760000.0,2.10496,100201000.0,14131000.0,1.0,73198000.0,90381000.0,134000.0,13935000.0
1084088,0.0,,Communications Equipment Manufacturing,,1.0,-19000.0,0.0,0.0,0.0,Mobicom Corp,1084088.0,0.0,0.0,0.0,0.0,0.0,0.0,810000.0,0.0,0.0,0.0,0.0,0.0,0.0,,0.0
1116112,,,Other Fabricated Metal Product Manufacturing,,1.0,,,,,US Fuel Corp,1116112.0,,,,,,,15740000.0,,,,0.0,,,,
1275490,0.0,,Metal Ore Mining,,1.0,-18000.0,-209000.0,235000.0,11000.0,Acadian Mining Corp,1275490.0,224000.0,224000.0,224000.0,-18000.0,224000.0,209000.0,590000.0,0.53333,8000.0,-18000.0,0.0,224000.0,235000.0,,11000.0
1271199,275000.0,72000.0,Metal Ore Mining,,0.0,-27648000.0,273000.0,5000.0,546000.0,Azarga Metals Corp,1271199.0,-527000.0,-527000.0,-527000.0,-1267000.0,-527000.0,2000.0,2210000.0,-9.56269,,-1267000.0,1.0,-527000.0,19000.0,,346000.0
1156297,,,Metal Ore Mining,,1.0,,,,,Camino Rojo Holdings Ltd,1156297.0,,,,,,,,,,,0.0,,,,
1498744,0.0,-37458.0,Metal Ore Mining,,0.0,-279575.0,,26387.0,30156.0,Mandalay Resources Corp,1498744.0,306590.0,306590.0,306590.0,-241542.0,306590.0,,830000.0,5.306169,,-240251.0,1.0,306590.0,336119.0,,30156.0
1514440,,,Oil and Gas Extraction,,0.0,,,,,Mountainview Energy Ltd,1514440.0,,,,,,,3980000.0,,,,0.0,,,,
1127706,,,Other Investment Pools and Funds,,1.0,,,,,Nuveen California Dividend Advantage Municipal Fund 2,1127706.0,,,,,,,200100000.0,,,,0.0,,,,
1087786,,,Other Investment Pools and Funds,,0.0,,,,,Nuveen New Jersey Quality Municipal Income Fund,1087786.0,,,,,,,89850000.0,,,,1.0,,,,
1087786,,,,,,,,,,,1177291.0,,,,,,,,,,,,,,,
1131063,,,Other Investment Pools and Funds,,1.0,,,,,Nuveen New York Dividend Advantage Municipal Fund 2,1131063.0,,,,,,,88510000.0,,,,0.0,,,,
1087788,,,Other Investment Pools and Funds,,1.0,,,,,Nuveen Ohio Dividend Advantage Municipal Fund,1087788.0,,,,,,,62110000.0,,,,0.0,,,,
1087787,,,Other Investment Pools and Funds,,1.0,,,,,Nuveen Pennsylvania Dividend Advantage Municipal Fund,1087787.0,,,,,,,,,,,0.0,,,,
1131062,,,Other Investment Pools and Funds,,1.0,,,,,Nuveen Dividend Advantage Municipal Fund 2,1131062.0,,,,,,,407390000.0,,,,0.0,,,,
1123871,18000.0,,Oil and Gas Extraction,,1.0,-156000.0,847000.0,480000.0,100000.0,Arena Resources Inc,1123871.0,2037000.0,763000.0,763000.0,18000.0,763000.0,445000.0,,0.10584,312000.0,18000.0,0.0,763000.0,2139000.0,44000.0,100000.0
1228068,,2915000.0,Direct Selling Establishments,-24636000.0,1.0,,,,,Crestwood Holdings LP,1228068.0,,,,10879000.0,,,,,192122000.0,16357000.0,0.0,,,11444000.0,
1103982,14355000000.0,-73000000.0,Bakeries and Tortilla Manufacturing,-107000000.0,0.0,2391000000.0,14193000000.0,7006000000.0,32320000000.0,Mondelez International Inc,1103982.0,23478000000.0,-12479000000.0,-12479000000.0,1882000000.0,-12479000000.0,162000000.0,67427810000.0,-7.19251,29234000000.0,4884000000.0,1.0,-12479000000.0,55798000000.0,962000000.0,8875000000.0
926326,0.0,421000.0,Computer Systems Design and Related Services,-2288000.0,0.0,-93962000.0,-23839000.0,59511000.0,52513000.0,Omnicell Inc,926326.0,19601000.0,18530000.0,18530000.0,-1167000.0,18530000.0,23839000.0,58610000.0,0.85515,86901000.0,-430000.0,1.0,18530000.0,72114000.0,,52150000.0
1564743,,,Metal Ore Mining,,1.0,,,,,Alpha Minerals Inc,1564743.0,,,,,,,60000.0,,,,0.0,,,,
1126577,,,Other Investment Pools and Funds,,1.0,,,,,Bluebook International Holding Co,1126577.0,,,,,,,28610000.0,,,,0.0,,,,
1137048,200000000.0,,Insurance Carriers,,1.0,45576000.0,,,3827419000.0,Odyssey Group Holdings Inc,1137048.0,820872000.0,820872000.0,820872000.0,-7961000.0,820872000.0,,,12.6011,,-15619000.0,0.0,820872000.0,4648291000.0,,
1035092,17054000.0,,Depository Credit Intermediation,,0.0,47412000.0,,,511433000.0,Shore Bancshares Inc,1035092.0,70970000.0,69495000.0,69495000.0,7994000.0,69495000.0,,125970000.0,8.6875,,,1.0,69495000.0,582401000.0,,
1115463,1491000.0,,Software Publishers,-1668000.0,0.0,-13626000.0,1302000.0,1051000.0,3480000.0,Alliance Media Holdings Inc,1115463.0,-1735000.0,-1995000.0,-1995000.0,-8853000.0,-1995000.0,189000.0,18170000.0,-4.81849,0.0,-2806000.0,1.0,-1995000.0,1746000.0,0.0,2970000.0
1129847,0.0,,Depository Credit Intermediation,,1.0,15214000.0,,,168321000.0,Project Hawks Merger Sub Llc,1129847.0,27719000.0,25624000.0,25624000.0,1861000.0,25624000.0,,23320000.0,8.78569,,,0.0,25624000.0,196038000.0,,
817129,,,Communications Equipment Manufacturing,,1.0,,,,,Telestone Technologies Corp,817129.0,,,,,,,36550000.0,,,,0.0,,,,
861050,1196000.0,166000.0,Nondepository Credit Intermediation,,,-980000.0,975000.0,238000.0,2118000.0,Cash Systems Inc,861050.0,-198000.0,-198000.0,-198000.0,-776000.0,-198000.0,221000.0,,-0.01671,8101000.0,-274000.0,,-198000.0,1921000.0,374000.0,2063000.0
1137774,11399000000.0,2737000000.0,Insurance Carriers,,0.0,41000000.0,,,272577000000.0,Prudential Financial Inc,1137774.0,20453000000.0,20453000000.0,20453000000.0,-154000000.0,20453000000.0,,19133570000.0,34.92776,,-121000000.0,1.0,20453000000.0,293030000000.0,,
1467373,66527000.0,34419000.0,Computer Systems Design and Related Services,,0.0,-1190415000.0,-731053000.0,4052311000.0,5040322000.0,Accenture PLC,1467373.0,438626000.0,271023000.0,271023000.0,244895000.0,271023000.0,1316976000.0,16826320000.0,0.29095,13105024000.0,1385451000.0,1.0,271023000.0,5478948000.0,,3327062000.0
1115818,,,Motion Picture and Video Industries,,1.0,,,,,Camelot Entertainment Group Inc,1115818.0,,,,,,,300000.0,,,,0.0,,,,
1417821,0.0,,Motor Vehicle Manufacturing,,0.0,-2583000.0,-2859000.0,3321000.0,537000.0,Azure Dynamics Corp,1417821.0,3414000.0,3416000.0,3416000.0,-2072000.0,3416000.0,2859000.0,,5.54338,95000.0,-2072000.0,1.0,3416000.0,3949000.0,83000.0,537000.0
1538789,0.0,-13940000.0,"Electric Power Generation, Transmission and Distribution",,0.0,2656000.0,49232000.0,28967000.0,65083000.0,Just Energy Group Inc,1538789.0,190857000.0,-103628000.0,-103628000.0,2058000.0,-103628000.0,19190000.0,499030000.0,-1.77449,183900000.0,-14862000.0,1.0,-103628000.0,255940000.0,37358000.0,19320000.0
1492658,,,Medical Equipment and Supplies Manufacturing,,0.0,,,,,Wright Medical Group NV,1492658.0,,,,,,,,,,,1.0,,,,
912875,1000000.0,53000.0,Metal Ore Mining,40000.0,1.0,-12922000.0,-12000.0,1980000.0,5623000.0,Wits Basin Precious Minerals Inc,912875.0,8007000.0,6825000.0,6825000.0,-9447000.0,6825000.0,1377000.0,2960000.0,0.63599,463000.0,-7940000.0,0.0,6825000.0,13627000.0,1642000.0,1646000.0
912875,,,,,,,,,,,1268175.0,,,,,,,,,,,,,,,
1434330,103100000.0,,Securities and Commodity Contracts Intermediation and Brokerage,,1.0,19000000.0,42800000.0,135900000.0,109100000.0,Pyxis Capital Inc,1434330.0,124400000.0,124400000.0,124400000.0,6900000.0,124400000.0,61900000.0,,0.60639,14800000.0,7200000.0,0.0,124400000.0,233500000.0,2100000.0,99200000.0
1130950,5603000.0,-1166000.0,Business Support Services,-1473000.0,1.0,-32650000.0,3980000.0,29186000.0,16716000.0,Excelligence Learning Corp,1130950.0,27574000.0,21501000.0,21501000.0,-35971000.0,21501000.0,1623000.0,,2.57058,92849000.0,-41962000.0,0.0,21501000.0,44290000.0,5485000.0,16702000.0
764794,,,,,,,,,,,,,,,,,,,,,,,,,,
946563,10265000.0,2049000.0,Medical Equipment and Supplies Manufacturing,-1643000.0,0.0,-40528000.0,12064000.0,6270000.0,18377000.0,Retractable Technologies Inc,946563.0,163000.0,-3386000.0,-3386000.0,-7215000.0,-3386000.0,1220000.0,77190000.0,-0.16711,16146000.0,-6713000.0,1.0,-3386000.0,18540000.0,,8798000.0
1122787,1447000.0,-10189000.0,Other Information Services,875000.0,1.0,-731000.0,-50533000.0,86270000.0,34904000.0,Napster Inc,1122787.0,121728000.0,59033000.0,59033000.0,2226000.0,59033000.0,51980000.0,,3.03138,141471000.0,7423000.0,0.0,59033000.0,156632000.0,4672000.0,32061000.0
1051116,10844000000.0,-3093000000.0,Pipeline Transportation of Natural Gas,-64000000.0,,4521000000.0,12827000000.0,8550000000.0,26403000000.0,Spectra Energy Capital LLC,1051116.0,8887000000.0,7158000000.0,7158000000.0,1350000000.0,7158000000.0,263000000.0,,7087128.71287,13452000000.0,2628000000.0,,7158000000.0,35290000000.0,668000000.0,9448000000.0
1119951,,,Pharmaceutical and Medicine Manufacturing,,1.0,,,,,Huifeng Bio Pharmaceutical Technology Inc,1119951.0,,,,,,,220000.0,,,,0.0,,,,
1139463,304193000.0,,General Medical and Surgical Hospitals,-4355000.0,1.0,-30786000.0,205800000.0,213333000.0,415351000.0,MedCath Corp,1139463.0,325690000.0,174242000.0,174242000.0,24351000.0,174242000.0,118768000.0,180120000.0,9.67392,477637000.0,55784000.0,0.0,174242000.0,741041000.0,37643000.0,115508000.0
1562180,11309.0,,Software Publishers,,0.0,-3706100.0,-310360.0,437268.0,302193.0,Solium Capital Inc,1562180.0,243136.0,243136.0,243136.0,-1801234.0,243136.0,321669.0,2250000.0,0.018345,120125.0,-1800588.0,0.0,243136.0,544701.0,87834.0,302193.0
1125557,,,Oil and Gas Extraction,,1.0,,,,,Powder River Petroleum International Inc,1125557.0,,,,,,,1020000.0,,,,0.0,,,,
1135017,0.0,160000.0,Pipeline Transportation of Crude Oil,,1.0,-15506000.0,,14671000.0,25913000.0,Kinder Morgan Management LLC,1135017.0,1008911000.0,1008911000.0,1008911000.0,17012000.0,1008911000.0,,998810000.0,15.06559,,0.0,0.0,1008911000.0,1034824000.0,,14571000.0
1117458,,,Other Chemical Product and Preparation Manufacturing,,1.0,,,,,O2Diesel Corp,1117458.0,,,,,,,,,,,0.0,,,,
1065034,0.0,-1028000.0,Software Publishers,,1.0,-121612000.0,-91946000.0,110874000.0,26965000.0,Magma Design Automation LLC,1065034.0,92744000.0,92744000.0,92744000.0,-29986000.0,92744000.0,91946000.0,292740000.0,3.06695,46357000.0,-15944000.0,0.0,92744000.0,119709000.0,,26835000.0
923284,493120000.0,,Lessors of Real Estate,,1.0,-138632000.0,488125000.0,,554770000.0,IRC Retail Centers Inc,923284.0,465593000.0,465593000.0,465593000.0,40666000.0,465593000.0,29977000.0,635150000.0,7.34465,145753000.0,39742000.0,0.0,465593000.0,1020363000.0,26151000.0,
1136294,,,Nonresidential Building Construction,,0.0,,,,,Williams Industrial Services Group Inc,1136294.0,,,,,,,,,,,1.0,,,,
1659458,,,Business Schools and Computer and Management Training,,0.0,,,,,Quizam Media Corp,1659458.0,,,,,,,1440000.0,,,,1.0,,,,
814623,0.0,-73000.0,Electrical Equipment Manufacturing,,0.0,-24441000.0,2115000.0,20000.0,5218000.0,Borealis Exploration Ltd,814623.0,-150000.0,-469000.0,-469000.0,-3315000.0,-469000.0,20000.0,,-0.09413,,-3315000.0,1.0,-469000.0,5067000.0,,883000.0
1137047,2065000.0,,Full-Service Restaurants,441000.0,1.0,-13364000.0,-4873000.0,14640000.0,14514000.0,Smith & Wollensky Restaurant Group Inc,1137047.0,56584000.0,45086000.0,45086000.0,-4295000.0,45086000.0,6938000.0,,4.81983,70619000.0,-3233000.0,0.0,45086000.0,71098000.0,3015000.0,7716000.0
1399708,509518.0,,Medical Equipment and Supplies Manufacturing,0.0,0.0,-56543.0,287114.0,373186.0,684174.0,Neovasc Inc,1399708.0,218634.0,218634.0,218634.0,124000.0,218634.0,222404.0,18740000.0,840.900509,475335.0,155000.0,1.0,218634.0,904065.0,25188.0,483131.0
1103090,,,"Navigational, Measuring, Electromedical, and Control Instruments Manufacturing",,0.0,,,,,Reflect Scientific Inc,1103090.0,,,,,,,110000.0,,,,1.0,,,,
930817,72000.0,159000.0,Other Amusement and Recreation Industries,,0.0,-12260000.0,-34000.0,106000.0,477000.0,AVP Inc,930817.0,-352000.0,-352000.0,-352000.0,-2946000.0,-352000.0,106000.0,20000.0,-0.26944,6000.0,-2886000.0,1.0,-352000.0,126000.0,921000.0,477000.0
1116937,,,,,,,,,,,,,,,,,,,,,,,,,,
356292,,,Oil and Gas Extraction,,0.0,,,,,Next Generation Management Corp,356292.0,,,,,,,160000.0,,,,1.0,,,,
1084597,,,"Engine, Turbine, and Power Transmission Equipment Manufacturing",,0.0,,,,,XZERES Corp,1084597.0,,,,,,,0.0,,,,0.0,,,,
1121980,1974000.0,-261000.0,Manufacturing and Reproducing Magnetic and Optical Media,-393000.0,1.0,-25886000.0,-45135000.0,52974000.0,18992000.0,Hpl Technologies Inc,1121980.0,82316000.0,37575000.0,37575000.0,-14917000.0,37575000.0,47109000.0,,1.27806,4513000.0,-15825000.0,0.0,37575000.0,101308000.0,294000.0,17912000.0
1141719,0.0,,Insurance Carriers,,1.0,3044000.0,,,1464480000.0,Alterra Capital Holdings Ltd,1141719.0,584070000.0,584070000.0,584070000.0,2531000.0,584070000.0,,418750000.0,14.75581,,2624000.0,0.0,584070000.0,2048550000.0,,
50710,,,Pharmaceutical and Medicine Manufacturing,,1.0,,,,,Javelin Pharmaceuticals Inc,50710.0,,,,-8059000.0,,,,,287000.0,-8117000.0,0.0,,,13000.0,
1211583,,,Pharmaceutical and Medicine Manufacturing,,0.0,,,,,Fennec Pharmaceuticals Inc,1211583.0,,,,-3597988.0,,,21690000.0,,0.0,-3908610.0,1.0,,,,
1304740,,,Depository Credit Intermediation,,1.0,,,,,Bridge Capital Holdings,1304740.0,,,,-2685000.0,,,37510000.0,,,,0.0,,,,
1069183,1320000.0,,Other Electrical Equipment and Component Manufacturing,-581000.0,0.0,515000.0,-4316000.0,7422000.0,2526000.0,Axon Enterprise Inc,1069183.0,5529000.0,5529000.0,5529000.0,515000.0,5529000.0,5636000.0,13350000.0,0.1685,6853000.0,772000.0,1.0,5529000.0,8054000.0,,2456000.0
1099358,,,Building Equipment Contractors,,1.0,,,,,Global Energy Group Inc,1099358.0,,,,,,,15160000.0,,,,0.0,,,,
1101215,310425000.0,,Nondepository Credit Intermediation,,0.0,8138000.0,192890000.0,463503000.0,971490000.0,Alliance Data Systems Corp,1101215.0,505728000.0,13731000.0,13731000.0,-10362000.0,13731000.0,117535000.0,1326540000.0,0.18559,773719000.0,50591000.0,1.0,13731000.0,1477218000.0,74204000.0,429729000.0
1761181,,,,,,,,,,,,,,,,,,,,,,,,,,
1405784,,,Printing and Related Support Activities,,0.0,,,,,Intertainment Media Inc,1405784.0,,,,,,,170000.0,,,,0.0,,,,
1405784,,,,,,,,,,,1385884.0,,,,,,,,,,,,,,,
1119601,99000.0,-11000.0,Electric Lighting Equipment Manufacturing,,1.0,-925000.0,99000.0,35000.0,495000.0,China Energy Savings Technology Inc,1119601.0,-418000.0,-418000.0,-418000.0,-227000.0,-418000.0,0.0,,-1.03235,748000.0,-225000.0,0.0,-418000.0,77000.0,,495000.0
1140536,787000000.0,1446000000.0,"Agencies, Brokerages, and Other Insurance Related Activities",,0.0,-165000000.0,675000000.0,7207000000.0,8253000000.0,Willis Towers Watson PLC,1140536.0,696000000.0,-505000000.0,-505000000.0,2000000.0,-505000000.0,128000000.0,4128680000.0,-9.11149,1424000000.0,161000000.0,1.0,-505000000.0,8949000000.0,68000000.0,7242000000.0
1140536,,,,,,,,,,,1478452.0,,,,,,,,,,,,,,,
1121785,374000.0,-106000.0,Audio and Video Equipment Manufacturing,18000.0,1.0,-2271000.0,326000.0,370000.0,670000.0,SLS International Inc,1121785.0,-263000.0,-263000.0,-263000.0,-1040000.0,-263000.0,48000.0,7280000.0,-0.01383,354000.0,-1001000.0,0.0,-263000.0,406000.0,,668000.0
1124024,,,Oil and Gas Extraction,,1.0,,,,,Far East Energy Corp,1294918.0,,,,,,,192150000.0,,,,0.0,,,,
1124024,,,,,,,,,,,1124024.0,,,,,,,,,,,,,,,
1094139,,,Animal Food Manufacturing,,1.0,,,,,Ourpet's Co,1094139.0,,,,,,,1220000.0,,,,0.0,,,,
1041609,,,Motor Vehicle Parts Manufacturing,,1.0,,,,,Mirenco Inc,1041609.0,,,,,,,4380000.0,,,,0.0,,,,
1137411,132000000.0,-32000000.0,"Navigational, Measuring, Electromedical, and Control Instruments Manufacturing",78000000.0,0.0,91000000.0,83000000.0,1433000000.0,1568000000.0,Rockwell Collins Inc,1137411.0,987000000.0,531000000.0,531000000.0,236000000.0,531000000.0,49000000.0,4255300000.0,2.9337,2492000000.0,343000000.0,0.0,531000000.0,2555000000.0,,1038000000.0
1444723,102966000.0,,"Electric Power Generation, Transmission and Distribution",,0.0,46528000.0,104053000.0,15496000.0,127621000.0,Caribbean Utilities Company Ltd,1444723.0,118280000.0,112272000.0,112272000.0,19275000.0,112272000.0,4921000.0,291170000.0,4.64174,,22503000.0,1.0,112272000.0,245900000.0,10358000.0,26947000.0
1092914,2089000.0,,Support Activities for Mining,,1.0,,-189000.0,3598000.0,4329000.0,Targa Pipeline Partners LP,1092914.0,21674000.0,19485000.0,19485000.0,8556000.0,19485000.0,2162000.0,41170000.0,5.97298,13130000.0,8556000.0,0.0,19485000.0,26002000.0,1356000.0,2240000.0
1083706,,,Manufacturing and Reproducing Magnetic and Optical Media,,0.0,,,,,EnXnet Inc,1083706.0,,,,,,,4240000.0,,,,1.0,,,,
1116198,,,Semiconductor and Other Electronic Component Manufacturing,,1.0,,,,,Sunrise Solar Corp,1116198.0,,,,,,,16240000.0,,,,0.0,,,,
1133478,4216173000.0,-155481000.0,Semiconductor and Other Electronic Component Manufacturing,152944000.0,1.0,-1561000.0,5401844000.0,4119647000.0,8502101000.0,ChipMOS Technologies Bermuda Ltd,1133478.0,7599181000.0,7443889000.0,7443889000.0,-1134927000.0,7443889000.0,2151050000.0,151810000.0,510.36228,5245095000.0,-1475799000.0,0.0,7443889000.0,16101282000.0,,3020943000.0
1277902,,,Depository Credit Intermediation,,0.0,,,,,MVB Financial Corp,1277902.0,,,,,,,8140000.0,,,,1.0,,,,
1344632,,,,,,,,,,,,,,,,,,,,,,,,,,
1004673,,-386000.0,Gambling Industries,25000.0,1.0,,,,,Entertainment Gaming Asia Inc,1004673.0,,,,-7566000.0,,,,,,-5838000.0,0.0,,,,
1104161,,35000.0,Other Investment Pools and Funds,,1.0,,,,,Impart Media Group Inc,1104161.0,,,,-699000.0,,,,,0.0,-678000.0,0.0,,,7000.0,
1377757,,,Metal Ore Mining,,0.0,,,,,Asanko Gold Inc,1377757.0,,,,,,,800000.0,,,,1.0,,,,
1140411,,,Other Investment Pools and Funds,,0.0,,,,,PIMCO California Municipal Income Fund,1140411.0,,,,,,,250960000.0,,,,1.0,,,,
1140392,,,Other Investment Pools and Funds,,0.0,,,,,PIMCO Municipal Income Fund,1140392.0,,,,,,,339380000.0,,,,1.0,,,,
1140410,,,Other Investment Pools and Funds,,0.0,,,,,PIMCO New York Municipal Income Fund,1140410.0,,,,,,,98250000.0,,,,1.0,,,,
1142810,,,Other Investment Pools and Funds,,,,,,,Bear Stearns Depositor Trust Certificates Series 2001-1 Inc,1142810.0,,,,,,,,,,,,,,,
1127439,0.0,,Wireless Telecommunications Carriers (except Satellite),-1000.0,1.0,-548000.0,-1259000.0,2468000.0,388000.0,Intac International Inc,1127439.0,2234000.0,2175000.0,2175000.0,-128000.0,2175000.0,1259000.0,,0.11394,24334000.0,-105000.0,0.0,2175000.0,2623000.0,,388000.0
1127696,,,Pharmaceutical and Medicine Manufacturing,41000.0,0.0,,,,,Health Sciences Group Inc,1127696.0,,,,-735000.0,,,5210000.0,,342000.0,-825000.0,1.0,,,,
1121282,696000.0,,Oilseed and Grain Farming,,0.0,-1022000.0,1024000.0,943000.0,1532000.0,Shandong Zhouyuan Seed and Nursery Co Ltd,1121282.0,116000.0,116000.0,116000.0,-426000.0,116000.0,121000.0,2440000.0,0.06836,0.0,-424000.0,1.0,116000.0,1648000.0,,1083000.0
1120096,,,Petroleum and Coal Products Manufacturing,,1.0,,,,,Sino Clean Energy Inc,1120096.0,,,,,,,,,,,0.0,,,,
1144331,560906000.0,-16729000.0,Scheduled Air Transportation,-10835000.0,1.0,-229361000.0,489029000.0,131369000.0,644112000.0,Expressjet Holdings Inc,1144331.0,-214361000.0,-232094000.0,-232094000.0,48074000.0,-232094000.0,71877000.0,656000000.0,-42.98037,980473000.0,100980000.0,0.0,-232094000.0,429751000.0,23045000.0,78834000.0
1401395,2552000.0,,Scientific Research and Development Services,-107000.0,0.0,-5160000.0,590000.0,3397000.0,4079000.0,Neptune Wellness Solutions Inc,1401395.0,2287000.0,2087000.0,2087000.0,-2550000.0,2087000.0,1962000.0,8130000.0,0.13344,,-2628000.0,1.0,2087000.0,6367000.0,36000.0,2124000.0
1099977,,,Seafood Product Preparation and Packaging,,0.0,,,,,China Marine Food Group Ltd,1099977.0,,,,,,,1350000.0,,,,1.0,,,,
1141103,48865000.0,,Employment Services,,0.0,12929000.0,46129000.0,108630000.0,92053000.0,Cross Country Healthcare Inc,1141103.0,269927000.0,26471000.0,26471000.0,8672000.0,26471000.0,2736000.0,455440000.0,0.82178,504364000.0,31688000.0,1.0,26471000.0,361979000.0,17551000.0,35899000.0
1126752,,,Wireless Telecommunications Carriers (except Satellite),,1.0,,,,,Pegasus Wireless Corp,1126752.0,,,,,,,,,,,0.0,,,,
1144519,1813000000.0,12000000.0,Grain and Oilseed Milling,-303000000.0,0.0,435000000.0,2101000000.0,3284000000.0,4067000000.0,Bunge Ltd,1144519.0,1376000000.0,1213000000.0,1213000000.0,134000000.0,1213000000.0,205000000.0,2389930000.0,14.5872,11484000000.0,527000000.0,1.0,1213000000.0,5443000000.0,,2346000000.0
878526,0.0,142000.0,"Navigational, Measuring, Electromedical, and Control Instruments Manufacturing",-1392000.0,0.0,-24299000.0,-53086000.0,62548000.0,3906000.0,Natus Medical Inc,878526.0,61029000.0,61029000.0,61029000.0,-3883000.0,61029000.0,53086000.0,64160000.0,3.84685,27401000.0,-4822000.0,1.0,61029000.0,64935000.0,,3906000.0
1120914,55000.0,224000.0,Semiconductor and Other Electronic Component Manufacturing,,0.0,-15369000.0,-70780000.0,79820000.0,10432000.0,PDF Solutions Inc,1120914.0,72884000.0,71715000.0,71715000.0,-3872000.0,71715000.0,70835000.0,159720000.0,3.12076,36848000.0,-6944000.0,1.0,71715000.0,83316000.0,337000.0,9826000.0
1610520,359302726152.0,,Other Financial Investment Activities,,0.0,23630173104.0,,,826909085016.0,UBS Group AG,1610520.0,28229795928.0,18313782360.0,18313782360.0,2270224190.0,18313782360.0,,84307750000.0,6.993946,,,1.0,18313782360.0,855138880944.0,,
7032,1875180000.0,-24732000.0,Special Food Services,3053000.0,1.0,553037000.0,1843608000.0,1098392000.0,3401117000.0,Aramark Services Inc,7032.0,858185000.0,-681400000.0,-681400000.0,251320000.0,-681400000.0,31572000.0,,-3.64377,8356007000.0,529581000.0,0.0,-681400000.0,4259302000.0,229608000.0,1303562000.0
1142750,1643000.0,,Employment Services,,0.0,-74339000.0,-30325000.0,151940000.0,37024000.0,AMN Healthcare Services Inc,1142750.0,271905000.0,143285000.0,143285000.0,-4386000.0,143285000.0,31968000.0,726980000.0,3.38815,517794000.0,8213000.0,1.0,143285000.0,308929000.0,7713000.0,35462000.0
1144967,28904000000.0,,Depository Credit Intermediation,,0.0,7414000000.0,,,218360500000.0,HDFC Bank Ltd,1144967.0,19513300000.0,19513300000.0,19513300000.0,4253800000.0,19513300000.0,,60801230000.0,6.93499,,,1.0,19513300000.0,237873800000.0,,
1136869,363900000.0,,Medical Equipment and Supplies Manufacturing,-50200000.0,0.0,55600000.0,345500000.0,508600000.0,666300000.0,Zimmer Biomet Holdings Inc,1136869.0,78700000.0,78700000.0,78700000.0,149800000.0,78700000.0,18400000.0,8087920000.0,0.40588,1178600000.0,248300000.0,1.0,78700000.0,745000000.0,,373100000.0
1137046,2014000.0,,Depository Credit Intermediation,,1.0,-2503000.0,,,27225000.0,Southern Connecticut Bancorp Inc,1137046.0,8275000.0,8275000.0,8275000.0,-1384000.0,8275000.0,,8220000.0,8.15271,,,0.0,8275000.0,35500000.0,,
9466,2678000000.0,-66600000.0,"Electric Power Generation, Transmission and Distribution",-14000000.0,1.0,419500000.0,2206500000.0,1000600000.0,3823100000.0,Baltimore Gas and Electric Co,9466.0,1131400000.0,1131400000.0,1131400000.0,97300000.0,1131400000.0,476500000.0,,2828.5,,311800000.0,0.0,1131400000.0,4954500000.0,221000000.0,978000000.0
1137391,,,Other Investment Pools and Funds,,0.0,,,,,BlackRock California Municipal Income Trust,1137391.0,,,,,,,197160000.0,,,,1.0,,,,
1137393,,,Other Investment Pools and Funds,,0.0,,,,,BlackRock Municipal Income Trust,1137393.0,,,,,,,569970000.0,,,,1.0,,,,
1137392,,,Other Investment Pools and Funds,,0.0,,,,,BlackRock Municipal Income Investment Trust,1137392.0,,,,,,,91000000.0,,,,1.0,,,,
1137440,,,Other Investment Pools and Funds,,1.0,,,,,BlackRock New Jersey Municipal Income Trust,1137440.0,,,,,,,101990000.0,,,,0.0,,,,
1137390,,,Other Investment Pools and Funds,,0.0,,,,,BlackRock New York Municipal Income Trust,1137390.0,,,,,,,168540000.0,,,,1.0,,,,
1144980,989712000.0,,Automobile Dealers,106081000.0,0.0,40888000.0,929206000.0,757614000.0,1117106000.0,Asbury Automotive Group Inc,1144980.0,347907000.0,-44949000.0,-44949000.0,44184000.0,-44949000.0,60506000.0,283970000.0,-1.32203,4150789000.0,116537000.0,1.0,-44949000.0,1465013000.0,27645000.0,609997000.0
12400,914931000.0,2062000.0,"Electric Power Generation, Transmission and Distribution",,,121875000.0,919635000.0,80699000.0,1051701000.0,Black Hills Power Inc,12400.0,221728000.0,110179000.0,110179000.0,48106000.0,110179000.0,14832000.0,,4.70521,,84108000.0,,110179000.0,1273429000.0,15773000.0,528253000.0
